Title,Abstract,Journal,Publishing Date,DOI,Probability of Inclusion
Multicommodity flows and Benders decomposition for restricted continuous location problems,"The restricted continuous facility location problem arises when there is a need to locate a number of facilities to serve a discrete set of demand points, and where the location of a facility can be anywhere on the plane except for in restricted regions. The problem finds applications in urban planning, disaster management, and healthcare logistics. The restricted regions can occur randomly or are known in advance. The paper describes a new model for the problem that is based on multicommodity flows with unknown destinations and defined on a discretization of the plane. The model and discretization are applied to both the deterministic and the stochastic continuous restricted location problem, where the latter is converted into a deterministic equivalent problem by minimizing the expected value of the objective function weighted by the probabilities of scenarios. The paper also describes a Benders decomposition algorithm to optimally solve the model. Extensive computational results are presented on both benchmark instances from the literature and new instances, on both the deterministic and stochastic variant of the problem. The results indicate that the proposed algorithm is superior to an off-the-shelf solver in terms of computational time. To the best of the authors’ knowledge, the exact algorithm described here is the first to address both the deterministic and the stochastic variants of continuous restricted location problems with any number of facilities.",European Journal of Operational Research,2018-05-01,10.1016/j.ejor.2017.11.033,0.8772230274448055
Role of Hospital Digital Services in Improvement of Clinical Regime of Patients,"Context: Healthcare supply chain management is the regulation of the flow of medical goods and services frommanufacturers to patients. Supply chain management encompasses the planning and managing of all activities involved in sourcing and procurement, conversion, and all logistics management activities. Therefore, it greatly helps material managers to manage through continuous improvement efforts while maintaining the quality of care. Moreover, reinforcing healthcare logistics information technology (IT) architecture immediately leads to more patient satisfaction. Objectives: This study aimed to develop an architecture for designing efficient software aiding with the management of the healthcare supply chain. Methods: This study showed the role of digital services in the improvement of the clinical regime of patients by presenting different approaches with distinguishing the main types of hospital logistics, such as physical flow management, food safety, and cold chain management approaches (e.g., “moving forward”), and modeling these components using the solution architecture principles of ITs, such as Business Process Model and Notation. Results: This study proposed a hospital enterprise architecture by modeling a system to have a base for building a digital catering service that improves the clinical regime of patients.",Health Technology Assessment in Action,2021-01-01,10.18502/htaa.v5i1.7381,0.8700913876160803
The multi-trip vehicle routing problem with increasing profits for the blood transportation: An iterated local search metaheuristic,"This paper studies a multi-trip routing problem of a shuttle fleet to transport blood units from collection sites to a blood center. In this problem, the blood units intended to produce platelets and cryoprecipitate must be processed within eight hours from their donation and arrive at the blood center at a time less than its closing time to guarantee enough processing time. Since it is assumed that blood units are donated at a collection site following a constant ratio over its operating hours, this problem is modeled as a multi-trip vehicle routing problem with increasing profits for which a mixed-integer linear programming formulation is proposed. A hybrid iterated local search metaheuristic and an extended version are developed as solution methods. The extended version includes a mixed-integer linear programming component into the local search of the hybrid metaheuristic to optimize the decision on the departure times of the trips. The solution methods are tested on a new set of instances based on the blood collection system of Bogota, Colombia.",Computers and Industrial Engineering,2022-08-01,10.1016/j.cie.2022.108294,0.8628838757727042
Revolutionizing healthcare 5.0: Blockchain-driven optimization of drone-to-everything communication using 5G network for enhanced medical services,"The healthcare industry has witnessed a notable surge in the adoption of drone technology for the swift and efficient transportation of vital medical supplies. In the expansive and uncontrolled realm where drones operate, challenges arise concerning authentication and secure data sharing. In the era of Healthcare 5.0, characterized by the integration of cutting-edge technologies, this article explores a groundbreaking approach to revolutionize medical services through the synergy of blockchain technology, drone-to-everything (D2X) communication, and the upcoming 5G network that provides enhanced broadband, extra reliable, low latency communication and massive machine type communication. This research addresses the critical task of delivering medical supplies using drone technology, focusing on ensuring the security, reliability and demand for a large storage capacity during the transportation of sensitive items. This research introduces an optimized communication link by using a blockchain network and the Internet of Things (IoT). To achieve such a goal two different algorithms are introduced and three different scenarios are implemented to include all possibilities in real applications. Three potential routes for data transmission, drone to drone, drone to ground user devices, and drone to base station, are explored to enhance communication efficiency. The contribution lies in optimizing the communication link to ensure a low bit error rate (BER), high signal-to-interference noise ratio (SINR) and maintain fixed signal power during data transmission. The outcomes of this study have significant implications for advancing healthcare logistics through the integration of cutting-edge technologies. The performance of the proposed method has been proven by simulations using parametric measurements.",Technology in Society,2024-06-01,10.1016/j.techsoc.2024.102552,0.8417842564655693
An Integrated Approach for Improving Logistics Systems: A Case Study of Hospital Logistics,"In order to provide an integrated approach to improve healthcare logistics. This paper integrated the analysis of logistics decisions made at the three hierarchical levels with the problem analysis and improvement suggestions. Following a thorough analysis of the problematic logistics decisions, alternative decisions were suggested to improve the current logistics system. The proposed forecasting technique is expected to reduce the average error in forecasting as a percent of average demand from 30.3% to 22.5%. The proposed methodology provides a new structured problem-analysis and problem-solving processes for healthcare logistics and it is expected to be a valuable management tool to improve the quality of patient care.",TEM Journal,2022-11-01,10.18421/TEM114-33,0.8251280423579348
Involving Motorbikes in Blood Pickup Services: A Mathematical Modelling Perspective,"The inclusion of smaller-size vehicles to enhance the performance of logistics systems has been a new trend in logistics, spanning from bicycles to drones. On the other hand, the motorbike has long been known as a common transportation mode, especially in developing countries, which opens the possibility to implement this vehicle mode in a healthcare logistics environment. Therefore, in this article, we discuss the possibility to involve a motorbike in the blood pickup service system. Here, we propose to mathematically model the system as a blood pickup routing problem with heterogeneous vehicle modes (BPRP-HV). Numerical experiments are then conducted, and managerial insights are derived from the results.","2021 5th Annual Systems Modelling Conference, SMC 2021",2021-09-14,10.1109/SMC53803.2021.9569938,0.8156299975875156
Divide and Conquer: A Location-Allocation Approach to Sectorization,"Sectorization is concerned with dividing a large territory into smaller areas, also known as sectors. This process usually simplifies a complex problem, leading to easier solution approaches to solving the resulting subproblems. Sectors are built with several criteria in mind, such as equilibrium, compactness, contiguity, and desirability, which vary with the applications. Sectorization appears in different contexts: sales territory design, political districting, healthcare logistics, and vehicle routing problems (agrifood distribution, winter road maintenance, parcel delivery). Environmental problems can also be tackled with a sectorization approach; for example, in municipal waste collection, water distribution networks, and even in finding more sustainable transportation routes. This work focuses on sectorization concerning the location of the area’s centers and allocating basic units to each sector. Integer programming models address the location-allocation problems, and various formulations implementing different criteria are compared. Methods to deal with multiobjective optimization problems, such as the (Formula presented.) -constraint, the lexicographic, and the weighted sum methods, are applied and compared. Computational results obtained for a set of benchmarking instances of sectorization problems are also presented.",Mathematics,2023-06-01,10.3390/math11112553,0.8145764145525153
A hierarchical decomposition framework for modeling combinatorial optimization problems,"Complex Optimization Problems has existed in many fields of science, including economics, healthcare, logistics and finance where a complex problem has to be solved. Thus, modeling a complex problem is a fundamental step to relax its complexity and achieve to a final solution of the master problem. Hierarchical optimization is a main step in optimization problems handling process. It consists of decomposing an optimization problem into two or more sub-problems; each sub-problem has its own objectives and constraints. It will help to prove the correct understanding and represent the problem in a different form that facilitates its solving. In this work, we stipulate that a hierarchical decomposition of complex problems can yield to more effective solutions. The proposed framework will contain four possible strategies which will be detailed through this paper; objective based decomposition; constraints based decomposition, semantic decomposition and data partitioning strategy. Each strategy will be argued by a set of examples from the literature to validate our framework. However, some conditions shall be verified to model the problem using such conditions are problems' characteristics that will help to identify if a combinatorial optimization problem can be modeled within the proposed framework and they are detailed in the following subsections.",Procedia Computer Science,2015-01-01,10.1016/j.procs.2015.08.169,0.8140425986929205
The impact of the first three months of the COVID-19 pandemic on the Australian trans community,"Background: Trans and gender diverse individuals (people who identify with a gender different to what was presumed for them at birth) are one of the most medically and socially marginalized groups in our community. The COVID-19 pandemic may compound preexisting depression and thoughts of self-harm or suicide. Aim: We aimed to explore the impact of the COVID-19 pandemic on the Australian trans community. Methods: An online cross-sectional survey was conducted between 1st May 2020 and 30th June 2020, amidst strict Australia-wide social restrictions. Australian trans people aged ≥16 years were eligible to participate. Survey questions explored the impact of the COVID-19 pandemic on living situation, employment, financial situation, and healthcare. Logistic regression to assess negative impacts due to COVID-19 on depression and thoughts of self-harm or suicide (measured by Patient Health Questionnaire-9 (PHQ-9) are presented as odds ratios (95% confidence interval)). Results: Of 1019 participants, 49.6% reported experiencing financial strain, 22% had reduced working hours, and 22.4% were unemployed (three times the national rate). Concerningly, 61.1% experienced clinically significant symptoms of depression (Patient Health Questionnaire-9 score ≥10), considerably higher than pre-COVID rates for the trans community and over twice the national rate. Moreover, 49% reported thoughts of self-harm or suicide (over three times the national rate) which was more likely if a person experienced cancelation or postponement of gender-affirming surgery (OR 1.56 (1.04, 2.35)), financial strain (OR 1.80 (1.36, 2.38)), or felt unsafe or afraid in their household (OR 1.96 (1.23, 3.08)). Discussion: Given rates of clinically significant depression and thoughts of self-harm or suicide are far higher in trans people than the general population, specific strategies to improve mental health in the trans community during the COVID-19 pandemic must be made a priority for policymakers, researchers, and health service providers to prevent suicide. Supplemental data for this article is available online at https://doi.org/10.1080/26895269.2021.1890659.",International Journal of Transgender Health,2023-01-01,10.1080/26895269.2021.1890659,0.8103060962531397
Pharmacy students' perspectives on the value of taking call during acute care practice experiences,"Objective. Determine graduates' perceptions of the benefits and limitations of taking call with the medicine team while in the experiential portion of the doctor of pharmacy (PharmD) degree program. Methods. Survey questionnaires were mailed to graduates who completed a medicine advanced pharmacy practice experience offering an on-call experience. Data collected included on-call requirements, participation, and perceptions of the benefits and limitations of participating in on-call activities. Results. Respondents generally agreed that they learned more about disease states and healthcare logistics during on-call experiences. Respondents also agreed it was a teambuilding experience and would encourage other students to take call. Conclusions. Taking call as a pharmacy student provides a unique opportunity to learn about disease states and build professional relationships with other healthcare professionals. This initial survey suggests that the perceived benefits of taking call outweigh the limitations, and that the experience incorporates professional development into pharmacy education.",American Journal of Pharmaceutical Education,2005-01-01,10.5688/aj690348,0.7936722742941039
How to use lean manufacturing for improving a Healthcare logistics performance,"Most companies in the world are focused on their global performance for being competitive on the market. Lean manufacturing is one of the main methodologies used by them for increasing their supply chain and logistics performance. Indeed, Logistics performance improvement implies the definition of KPIs (Key Performance Indicators) for measuring at each transformation level, the evolution of the logistics system. Thus, Industry 4.0 and logistics 4.0 concepts are defined for implementing new technologies, tools and organizations in companies in order to define their future. A new framework, based on lean manufacturing and DMAIC methodologies, with sustainability as its kernel has been developed in Icam, A Higher education school, for SMEs. In addition, European population is growing older day by day and they are regularly visiting hospitals. In this context, the treatment of patients in good conditions (quality, cost and lead time) is necessary as much as the hospital global performance. In this frame, a project is ongoing between FEI, a Brazilian University and Icam for defining and implementing Healthcare Logistics 4.0 (including lean manufacturing). This paper presents concepts, methods and tools of healthcare logistics 4.0 for improving a hospital performance. Examples on medicines tracking, medicine and food dispatching will be given as result and detailed for illustrating concepts presented.",Procedia Manufacturing,2020-01-01,10.1016/j.promfg.2020.10.231,0.7894058402691102
Revolutionising healthcare logistics: the significance of direct-to-patient care,"At its core, direct-to-patient (DTP) care entails delivering healthcare services directly to patients in their homes or workplaces rather than in a hospital or clinic. This can encompass a range of services, from telemedicine consultations to home-delivered medication, or even advanced medical procedures conducted at home.",Pharmaceutical Manufacturing and Packing Sourcer,2024-01-01,,0.7801209687960272
An Automated Enhancement System of Diabetic Retinopathy Fundus Image for Eye Care Facilities,"Examining retinal fundus images is compulsory for ophthalmologists to spot features of eye diseases. Some problems, including low contrast and blurred retinal fundus image, may seriously affect the diagnostic procedure, leading to misdiagnosis. Low quality of retinal fundus image makes recognition of features for Diabetic Retinopathy (DR) to be harder for the ophthalmologist. Moreover, there is a lack of eye care facilities infrastructure with ophthalmologists to serve multi-morbid DR patients in rural areas, specifically Malaysia. Hence, this research proposed the development of an automated enhancement system based on computer vision and the Artificial Intelligence (AI) field to improve the quality of fundus images captured. The DR Enhancement System (DRES) helps ophthalmologists in the screening aspect by improving the detection of aberrant fundus images. Several methods for improving the fundus image are utilized: Retinex, Contrast Limited Adaptive Histogram Equalization (CLAHE), and Low-light enhancement. Results show that all methods performed better when improving low-contrast and blurred images. This study contributes to the screening process of DR by improving the quality of the retinal fundus image. The developed AI-based system can also help to solve healthcare logistics problems of reaching DR patients in rural areas.",Communications in Computer and Information Science,2024-01-01,10.1007/978-981-99-9592-9_8,0.7779611885731365
Study and Analysis of Discrete Event-Driven Autonomous System with a Case Study for a Robotics Task,"Highly probabilistic, potential, and dynamic domains are only relatively known to contribute classical techniques for complex system establishment impossible. Currently available technologies and strategies do not adequately address these novel needs. Thus, by enabling autonomous systems to adapt, decision-making and learning abilities, we can empower them with sufficient and appropriate expertise to recognize and address such issues. To address these requirements, discrete event-driven systems (DEDS) have been developed. This system can help the technologists of future autonomous systems by simulating the effect of auxiliary designs on the performance of the autonomous system. For modeling regular feedback of performance that is influenced by traditional techniques and depends on trust, the discrete event-driven method is most suited. This paper describes the DEDS system, the modeling of this system, and as well as the supervisory control system by explaining the supervisor, and partial supervisor. A comprehensive literature survey has been carried out in this article to explain the controllability, diagnosability, and observability potential of the DEDS system for various applications. Some of the major areas of applications such as healthcare, logistics, robotics, and banking sectors, have been discussed. Also, we have explained this system with the help of modeling a discrete event system for a queuing problem associated with robotics tasks as an example by the simulation with MATLAB 2022a. Lastly, the possible future research directions in the DEDS advancement have been provided.",Przeglad Elektrotechniczny,2023-01-01,10.15199/48.2023.09.09,0.7608915056715579
Paving the way for warehouse centralization in healthcare: A preliminary assessment approach,"Centralized logistics management is currently one interesting option for healthcare systems facing an increasing need to improve responsiveness and service quality while reducing costs. This work focuses on one aspect of centralized logistics, namely warehouse centralization and proposes a preliminary approach to assess material management in healthcare institutions as a first step towards decisions about the implementation of such a strategy. A list of variables and relationships between them characterizing warehouse material management are identified based on a literature review and knowledge of real logistics processes. Statistical analysis is then applied to assess the existence of such relationships in a set of healthcare organizations in order to understand the management commonalities that can stimulate warehouse centralization as well as the criticalities that could potentially hinder it. The approach is tested in a healthcare logistics system in Northern Italy. The results proved the ability of the methodology to identify the relevant issues the involved institutions need to work on when undertaking warehouse centralization strategies. The case warehouses revealed a good degree of commonalities in their management practices although three critical aspects were identified, namely a limited efficiency in human resource allocation, a high fragmentation of stock product demand and a relevant number of stock products with low annual demand. This work provides a methodology to increase material managers’ awareness about the factors enabling successful centralized inventory strategies in the healthcare sector.",American Journal of Applied Sciences,2016-05-05,10.3844/ajassp.2016.490.500,0.7587550200968246
Improved renal cancer prognosis among users of drugs targeting renin-angiotensin system,"Purpose: We explored renal cell cancer (RCC) survival among users of antihypertensive medication as hypertension is proposed to be a risk factor for RCC and ACE-inhibitors and angiotensin receptor blockers (ARBs) have been associated with improved prognosis of RCC. Methods: Finnish cohort of 13,873 participants with RCC diagnosed between 1995–2012 was formed from three national databases. RCC cases were identified from Finnish Cancer Registry, medication usage from national prescription database and co-morbidities from Care Registry of Healthcare. Logistic regression was used to calculate odds ratios for metastatic tumor extent at the time of diagnosis. Risk of RCC specific death after diagnosis was analyzed using Cox regression adjusted for tumor clinical characteristics. Results: A total of 5,179 participants died of RCC during the follow-up. No risk association was found for metastatic tumor extent for any drug group. ACE-inhibitors, but no other drug group were associated with decreased risk of RCC specific death overall (HR 0.88, 95% CI 0.82–0.95) compared to non-users. In time-dependent analysis high-dose use of ACE-inhibitors (392 Defined Daily Dose (DDD)/year), HR 0.54, 95% CI 0.45–0.66) and ARBs (786.1 DDD/year, HR 0.66, 95% CI 0.50–0.87) associated with improved RCC survival. No information of TNM-classification or tobacco smoking was available. Conclusion: ACE-inhibitors and ARBs in high dose associated with improved RCC specific survival. This may reflect overall benefit of treating hypertension with medication targeting renin-angiotensin system (RAS) system among RCC patients. Further studies are needed to explore the role of RAS in RCC.",Cancer Causes and Control,2022-02-01,10.1007/s10552-021-01527-w,0.7503858948163257
