Title,Abstract,Journal,Publishing Date,DOI,Probability of Inclusion
Hybrid predetection technique for efficient tag identification in radio-frequency identification systems,"Radio-frequency identification (RFID) is a noncontact automatic identification technology that has been widely used in various modern industries. Due to the continuous improvement in sensing capabilities, energy autonomy, affordability, and usability, RFID is one of the key enabling technologies in realizing the Internet of Things (IoT). With their non-line-of-sight wireless transmission, wireless power, and sensing capability, lightweight RFID sensor tags can be connected to people or objects, which is crucial for future IoT applications such as healthcare, logistics, and manufacturing. The RFID approach with the simultaneous reading of multiple tag features can quickly identify connected “things” for further data communication and integration. Reducing the identification processing time for many tags located inside the interrogation range of the reader is essential. Therefore, an effective protocol must be developed to prevent collisions and reduce useless queries between the reader and tags to achieve rapid identification. Predetection tree-based algorithms, which are based on certain small predetection timeslots that tags can respond to, can eliminate unnecessary idle slots and prevent collision slots. In this paper, an efficient predetection-based anticollision algorithm has been proposed to achieve outstanding tag identification performance. The numbers of collision slots and idle slots are reduced by exploiting a novel predetection mechanism and slot size adjustment technique. Simulation results indicate that the proposed scheme reduces the tag identification time by approximately 30-60% compared with previously proposed predetection-based protocols. Moreover, the numbers of query cycles, collisions, and slots are smaller in the proposed scheme than in the previously proposed protocols.",Sensors and Materials,2021-01-01,10.18494/SAM.2021.3381,0.31993025273863107
Artificial Intelligence for Smart Cities: Locational Planning and Dynamic Routing of Emergency Vehicles,"To enhance the efficiency and effectiveness of essential emergency services such as ambulances, fire brigades, and police, one of the most important problems to tackle is to minimize the response times of these emergency vehicles. As well as attaining optimal waiting sites and deployment strategies for the emergency vehicles, the optimal routing and traffic preemption of the vehicles are also crucial in minimizing response times and maximizing coverage. As locational planning and dynamic routing of the emergency vehicles relate to many different situations with varying emergency levels, they are a crucial part of the smart city concept. In this chapter, we present a perspective for the use of artificial intelligence and optimization in sustainable healthcare logistics within a smart city. We provide a survey of literature and identify many applications from around the globe. Related mathematical models and solution approaches are also presented, as necessary.","Accounting, Finance, Sustainability, Governance and Fraud",2022-01-01,10.1007/978-981-16-8997-0_3,0.31149252897208185
How important is income in explaining individuals having forgone healthcare due to cost-sharing payments? Results from a mixed methods sequential explanatory study,"Background: Patients having forgone healthcare because of the costs involved has become more prevalent in recent years. Certain patient characteristics, such as income, are known to be associated with a stronger demand-response to cost-sharing. In this study, we first assess the relative importance of patient characteristics with regard to having forgone healthcare due to cost-sharing payments, and then employ qualitative methods in order to understand these findings better. Methods: Survey data was collected from a Dutch panel of regular users of healthcare. Logistic regression models and dominance analyses were performed to assess the relative importance of patient characteristics, i.e., personal characteristics, health, educational level, sense of mastery and financial situation. Semi-structured interviews (n = 5) were conducted with those who had forgone healthcare. The verbatim transcribed interviews were thematically analyzed. Results: Of the 7,339 respondents who completed the questionnaire, 1,048 respondents (14.3%) had forgone healthcare because of the deductible requirement. The regression model indicated that having a higher income reduced the odds of having forgone recommended healthcare due to the deductible (odds ratios of higher income categories relative to the lowest income category (reference): 0.29–0.49). However, dominance analyses revealed that financial leeway was more important than income: financial leeway contributed the most (34.8%) to the model’s overall McFadden’s pseudo-R2 (i.e., 0.123), followed by income (25.6%). Similar results were observed in stratified models and in population weighted models. Qualitative analyses distinguished four main themes that affected the patient’s decision whether to use healthcare: financial barriers, structural barriers related to the complex design of cost-sharing programs, individual considerations of the patient, and the perceived lack of control regarding treatment choices within a given treatment trajectory. Furthermore, “having forgone healthcare” seemed to have a negative connotation. Conclusion: Our findings show that financial leeway is more important than income with respect to having forgone recommended healthcare due to cost-sharing payments, and that other factors such as the perceived necessity of healthcare also matter. Our findings imply that solely adapting cost-sharing programs to income levels will only get one so far. Our study underlines the need for a broader perspective in the design of cost-sharing programs.",BMC Health Services Research,2022-12-01,10.1186/s12913-022-07527-z,0.30660312729378175
Optimal Multikey Homomorphic Encryption with Steganography Approach for Multimedia Security in Internet of Everything Environment,"Recent developments of semiconductor and communication technologies have resulted in the interconnection of numerous devices in offering seamless communication and services, which is termed as Internet of Everything (IoE). It is a subset of Internet of Things (IoT) which finds helpful in several applications namely smart city, smart home, precise agriculture, healthcare, logistics, etc. Despite the benefits of IoE, it is limited to processing and storage abilities, resulting in the degrada-tion of device safety, privacy, and efficiency. Security and privacy become major concerns in the transmission of multimedia data over the IoE network. Encryption and image steganography is considered effective solutions to accomplish secure data transmission in the IoE environment. For resolving the limitations of the existing works, this article proposes an optimal multikey homomorphic encryption with steganography approach for multimedia security (OMKHES‐MS) technique in the IoE environment. Primarily, singular value decomposition (SVD) model is applied for the separation of cover images into RGB elements. Besides, optimum pixel selection process is carried out using coyote optimization algorithm (COA). At the same time, the encryption of secret images is performed using poor and rich optimization (PRO) with multikey homomorphic encryption (MKHE) technique. Finally, the cipher image is embedded into the chosen pixel values of the cover image to generate stego image. For assessing the better outcomes of the OMKHES‐MS model, a wide range of experiments were carried out. The extensive comparative analysis reported the su-premacy of the proposed model over the rennet approaches interms of different measures.",Applied Sciences (Switzerland),2022-04-01,10.3390/app12084026,0.29016026219917346
The Use of Unmanned Aerial Vehicles in Healthcare Logistic: Risks and Opportunities,"In this paper, the authors analyze the application of unmanned vehicle technologies in various industries, including healthcare. The risks and possibilities of using such technologies are analyzed. The authors propose to consider the application of such technology from the point of view of key medical concepts such as the delivery of goods (medicines), organs. Also, paper Describes the world practice of introducing drones in the healthcare sector in countries such as the USA, China, Korea, Canada. The authors formulate a motivational expansion model for internal and external drivers necessary to understand the purpose of using unmanned aerial vehicle technologies.",Lecture Notes on Data Engineering and Communications Technologies,2023-01-01,10.1007/978-3-031-24434-6_14,0.2792118989596965
An efficient adaptive large neighborhood search algorithm based on heuristics and reformulations for the generalized quadratic assignment problem,"Operations Research (OR) analytics play a crucial role in optimizing decision-making processes for real-world problems. The assignment problem, with applications in supply chains, healthcare logistics, and production scheduling, represents a prominent optimization challenge. This paper focuses on addressing the Generalized Quadratic Assignment Problem (GQAP), a well-known NP-hard combinatorial optimization problem. To tackle the GQAP, we propose an OR analytical approach that incorporates efficient relaxations, reformulations, heuristics, and a metaheuristic algorithm. Initially, we employ the Reformulation Linearization Technique (RLT) to generate various linear relaxation models, carefully selecting the most efficient ones. Building upon this foundation, we introduce a robust reformulation based on Benders Decomposition (BD), which serves as the basis for an iterative optimization algorithm applied to the GQAP. Furthermore, we develop a constructive heuristic algorithm to identify near-optimal solutions, followed by an enhancement utilizing an Adaptive Large Neighborhood Search (ALNS) metaheuristic algorithm. This ALNS algorithm is enhanced through the integration of a tabu list derived from Tabu Search (TS) and a decision rule inspired by Simulated Annealing (SA). To validate our approach and evaluate its performance, we conduct a comparative analysis against state-of-the-art algorithms documented in the literature. This comparison confirms the significant improvements achieved in terms of solution quality and computational efficiency through our proposed methodology. These advancements contribute to the state of the art in solving the GQAP and hold the potential to enhance decision-making processes in a wide range of domains. Our methodology demonstrates remarkable improvements in solution quality and computational efficiency when compared to existing approaches, as evidenced by the comparative results with state-of-the-art algorithms. The potential implications of our research extend to optimizing decision-making processes in diverse fields, rendering it highly relevant and impactful.",Engineering Applications of Artificial Intelligence,2023-11-01,10.1016/j.engappai.2023.106802,0.2726767547249211
Statistical assessment of hybrid blockchain for sme sector,"Blockchain innovation with its property of immutable data isn't just limited to digital cryptographic forms of money yet in addition for various domains like healthcare, logistics, rentals, entertainment, social media and so on. Ventures are investigating this innovation to adopt in main line of business, which will give certainty on security ceasing data breach. This research paper has built up a hybrid blockchain framework which can be utilized on premise or over the cloud or a combination of both and can be utilized by various departments for protecting transactions in small and medium scale businesses with an uprightness of high security, transparency, remote devices, accessibility and cost adequacy. This created framework compares with the traditional approach model on some significant factors for statistical assessment. The analysis discovers how this hybrid blockchain framework is more productive and secured than the client server approach model and aims to be utilized as platform as a service both in local or hybrid cloud infrastructure.",WSEAS Transactions on Systems and Control,2021-01-01,10.37394/23203.2021.16.6,0.2463354965106841
The Wings of Wellness: Autonomous Medical Delivery Drones Enhancing Patient Care and Accessibility,"This paper represents the advent of drones, that has rushed in a new era in healthcare logistics by providing a swift and efficient means of medical supply delivery. Access to timely medical supplies is often hampered by traffic congestion, geographical barriers, and unpredictable emergencies. Drones that transport pharmaceuticals have come to be considered as an ideal solution to these issues of concern. By leveraging cutting-edge technology, these autonomous flying machines are capable of transporting medical essentials, such as medications, vaccines, blood samples, and even life-saving equipment, to remote and underserved areas with unparalleled speed and precision. The advantages of using drones, such as reduced transportation time, cost-effectiveness, and minimized human contact during the pandemic, which has been crucial in curbing disease transmission. The future of healthcare delivery is poised to be significantly transformed by medical delivery drones. These innovative aerial vehicles have the potential to bridge healthcare disparities, enhance emergency response, and save countless lives. As technology advances and regulations evolve, the integration of medical delivery drones into healthcare ecosystems will continue to evolve, offering hope for improved healthcare access and outcomes across the globe","Proceedings of 9th International Conference on Science, Technology, Engineering and Mathematics: The Role of Emerging Technologies in Digital Transformation, ICONSTEM 2024",2024-01-01,10.1109/ICONSTEM60960.2024.10568822,0.22533246448664654
A Locational Analysis Model of the COVID-19 Vaccine Distribution,"Even and equitable distribution of the COVID-19 vaccine becomes one of key strategies to reduce the number of positive cases and virus transmissions all over the world. This paper aims to introduce and demonstrate a mathematical model based on a maximal covering location problem (MCLP) to optimise the coverage of the COVID-19 vaccine distribution. A mathematical model is proposed and demonstrated using an illustrative case study of healthcare facilities and location coordinates of villages in Yogyakarta, Indonesia. A numerical computer experiment is conducted to obtain optimal results of the locational analysis. The results show that the proposed model provides an efficient coverage of vaccination by minimising the distances travelled by the target population. It also reveals an interesting insight that prioritising vaccination for areas with high COVID-19 cases results in a less efficient coverage. The novel location-allocation model for COVID-19 vaccination facilities proposed in this paper particularly applies in a developing country. The model could be used as an alternative way to increase the vaccination coverage and priority whilst minimising the potential risks of the virus transmissions and transport costs.",Operations and Supply Chain Management,2022-01-01,10.31387/oscm0490344,0.21495643411526014
"Intelligent Connectivity: AI, IoT, and 5G","Intelligent Connectivity: AI, IoT, and 5G delivers a comprehensive technological and economic analysis of intelligent connectivity and the integration of artificial intelligence, Internet of Things (IoT), and 5G. It covers a broad range of topics, including Machine-to-Machine (M2M) architectures, edge computing, cybersecurity, privacy, risk management, IoT architectures, and more. The book offers readers robust statistical data in the form of tables, schematic diagrams, and figures that provide a clear understanding of the topic, along with real-world examples of applications and services of intelligent connectivity in different sectors of the economy. Intelligent Connectivity describes key aspects of the digital transformation coming with the 4th industrial revolution that will touch on industries as disparate as transportation, education, healthcare, logistics, entertainment, security, and manufacturing. Readers will also get access to: A thorough introduction to technology adoption and emerging trends in technology, including business trends and disruptive new applications Comprehensive explorations of telecommunications transformation and intelligent connectivity, including learning algorithms, machine learning, and deep learning Practical discussions of the Internet of Things, including its potential for disruption and future trends for technological developmentIn-depth examinations of 5G wireless technology, including discussions of the first five generations of wireless techIdeal for telecom and information technology managers, directors, and engineers, Intelligent Connectivity: AI, IoT, and 5G is also an indispensable resource for senior undergraduate and graduate students in telecom and comp uter science programs.","Intelligent Connectivity: AI, IoT, and 5G",2021-01-01,10.1002/9781119685265,0.2133921220823568
"Enterprise IoT Modeling: Supervised, Unsupervised, and Reinforcement Learning","The Internet of Things (IoT)—the internetworking of physical devices—has been a significant advancement in recent decades and has been the catalyst for several other innovations. New Industrial Internet of Things (IIoT) platforms aim to solve the most complex challenge of manufacturers: consolidating all production systems into a single data model. They are used in smart cities, security and emergencies, environmental applications, energy, healthcare, logistics, industrial control, home automation, agriculture, and animal farming. These objects/devices/appliances can generate, collect, and exchange data without human-to-human or human-to-computer interactions. The IIoT is creating an explosion in structured and unstructured data from a growing army of sensors capable of registering locations, voices, faces, audio, temperature, sentiment, health, and others. Billions of IoT devices are interconnected and a huge volume of data is generated. Every device features automation to assist people in the planning, management, and decision-making of their day-to-day activities. Machine learning (ML) techniques are applied to further enhance the intelligence and capabilities of an application. Many researchers are interested in producing advanced IoT technology, combining ML and IoT Techniques. Through ML, IIoT devices learn to perform tasks such as predication, pattern recognition, classification, and clustering. To provide for a learning process, IoT devices are trained using various algorithms in ML and statistical models to analyze sample data. The various fields of data sets (structured and unstructured data) are characterized by measuring functional parameters. Later, ML algorithms are applied to the data set to find features, provide useful output, identify patterns or make decisions based on the data set, draw inferences from real-time data streams, make their results available to analysts, and embed their results directly in business processes. In ML, the real-time problem is classified by classification, clustering, regression models, and association rules. Based on the learning style, ML algorithms can be categorized as supervised, unsupervised, semi-supervised, and reinforcement learning.",EAI/Springer Innovations in Communication and Computing,2020-01-01,10.1007/978-3-030-44407-5_3,0.20593439177428394
A novel group ownership transfer protocol for RFID systems,"Radio Frequency Identification (RFID) is a wireless communication technology nowadays widely used in almost every aspect of our lives including healthcare, logistics and supply chain management, inventory tracking, race timing, access control, toll collection, and a lot more. In RFID systems, a tag usually stores private or sensitive information, and so it needs an access control mechanism. When a tag's owner is changed, the read permission of the tag needs to be transferred from the old owner to the new owner, and this is when ownership transfer schemes come into play. In fact, not only do RFID ownership transfer schemes do ownership transfer, but they have to make sure that the ownership transfer procedure is executed under proper security protection. Besides, in some particular environments, the ownership transfer would be far more efficiently done if the tags could be treated as a group instead of individual tags. Therefore, in this paper, we propose a novel group ownership transfer protocol that satisfies all important security requirements including mutual authentication, data and location privacy, forward/backward secrecy, ownership privacy, and group ownership integrity. In addition, due to the use of cloud computing, our new protocol provides ubiquitous authentication. Based on homomorphic encryption and quadratic residues, our novel RFID group ownership transfer protocol can have encrypted data efficiently processed, and the communication cost is very low. The results of our BAN logic correctness check, security analysis, and performance evaluation confirm that the new protocol is logically correct and is capable of providing high level security/privacy protection on the basis of high cost-effective performance.",Ad Hoc Networks,2019-08-01,10.1016/j.adhoc.2019.101873,0.19873594490358393
The business value of RFID,"RFID can be defined as a strategic technology tool redesigning business processes, cutting costs, and improving the operational performance. It is used for a wide variety of application areas ranging from retail to manufacturing, healthcare, logistics, and defense. It may improve the potential benefits of supply chain management through increase of the four factors: efficiency, accuracy, visibility, and security. Calculating the return on investments, the impact levels of RFID on these factors should be quantified accurately for each supply chain member. This chapter focuses on the question how RFID adds value to business processes in the context of these factors.",The Value of RFID: Benefits Vs. Costs,2013-01-01,10.1007/978-1-4471-4345-1_1,0.19624851495438575
RFID adoption in healthcare and ROI analysis,"RFID is becoming one of the major enabling technologies being considered and adopted into healthcare logistics applications. In this chapter, the authors deliver an overview of the role of RFID in the healthcare industry and introduce some of the basics of sound business case development. To this end, samples of case studies prepared over the past 5 years are presented. In addition, an actual RFID implementation business case and its ROI analysis are included to demonstrate the benefits of the technology in greater detail.",The Value of RFID: Benefits Vs. Costs,2013-01-01,10.1007/978-1-4471-4345-1_7,0.1955410105075199
Application of hybrid computational intelligence in health care,"The use of hybrid computational intelligence is currently broadening in the field of healthcare applications and research. Computational intelligence has played a vital role in health care for a significant period of time, but with the increased popularity and extensive use of these hybrid computational intelligent systems, a shift has been seen also in the field of health care. Hybrid computational intelligence can be implied in the field of decision making, remote monitoring, healthcare logistics, and modern information systems. Hybrid computational intelligence synergizes different computational intelligence techniques, such as the neural network, the fuzzy logic, the genetic algorithms, the evolutionary computation and the support vector machines, and have their application in the field of pattern recognition, system modeling, etc. In this chapter, we focus on the need for healthcare information technology, improvement of healthcare delivery systems, healthcare safety issues, and also various areas where it can be used.",Hybrid Computational Intelligence: Challenges and Applications,2020-01-01,10.1016/B978-0-12-818699-2.00007-X,0.18077350749399468
Reliable internet of things network architecture based on high altitude platforms,"Internet of Things (IoT) has become a hot topic of technical, social and economic significance in recent times. Projections on its impact are highly impressive, where over 100 billion of devices have been projected to be IoT connected with a global economic impact of more than $11 trillion by 2025. In this paper, we propose a reliable IoT network architecture based on high altitude platforms as an alternative standalone network that is well-positioned to provide seamless connectivity and coverage in remote areas. Potential applications of the proposed IoT network architecture are demonstrated in smart cities, healthcare, logistics, finance, agriculture and construction.","2019 Conference on Information Communications Technology and Society, ICTAS 2019",2019-04-30,10.1109/ICTAS.2019.8703519,0.15542880188998515
