Title,Abstract,Journal,Publishing Date,DOI,Probability of Inclusion
Early Determinants of Length of Hospital Stay: A Case Control Survival Analysis among COVID-19 Patients admitted in a Tertiary Healthcare Facility of East India,"Background: Length of hospital stay (LOS) for a disease is a vital estimate for healthcare logistics planning. The study aimed to illustrate the effect of factors elicited on arrival on LOS of the COVID-19 patients. Materials and Methods: It was a retrospective, record based, unmatched, case control study using hospital records of 334 COVID-19 patients admitted in an East Indian tertiary healthcare facility during May to October 2020. Discharge from the hospital (cases/survivors) was considered as an event while death (control/non-survivors) as right censoring in the case-control survival analysis using cox proportional hazard model. Results: Overall, we found the median LOS for the survivors to be 8 days [interquartile range (IQR): 7-10 days] while the same for the non-survivors was 6 days [IQR: 2-11 days]. In the multivariable cox-proportional hazard model; travel distance (>16 km) [adjusted hazard ratio (aHR): 0.69, 95% CI: (0.50-0.95)], mode of transport to the hospital (ambulance) [aHR: 0.62, 95% CI: (0.45-0.85)], breathlessness (yes) [aHR: 0.56, 95% CI: (0.40-0.77)], number of co-morbidities (1-2) [aHR: 0.66, 95% CI: (0.47-0.93)] (≥3) [aHR: 0.16, 95% CI: (0.04-0.65)], COPD/asthma (yes) [[aHR: 0.11, 95% CI: (0.01-0.79)], DBP (<60/≥90) [aHR: 0.55, 95% CI: (0.35-0.86)] and qSOFA score (≥2) [aHR: 0.33, 95% CI: (0.12-0.92)] were the significant attributes affecting LOS of the COVID-19 patients. Conclusion: Factors elicited on arrival were found to be significantly associated with LOS. A scoring system inculcating these factors may be developed to predict LOS of the COVID-19 patients.",Journal of Primary Care and Community Health,2021-01-01,10.1177/21501327211054281,0.6426821093542029
From network approach to ecosystem approach: A new framework for change management,"The actual change management models drawn from literature are focused only on the perspective of a single organisation. This perspective is not coherent with the new business scenario created by the pervasive use of digital technologies, which requires a new way to deal with organizational change. In particular, organizations have to manage change in a collaborative way, reflecting a progressive shift from a network to an ecosystem approach. Starting from this perspective, this paper aim to present a change on management framework in order to manage innovation within a complex digital ecosystem of actors. Coherently with this goal, the proposed framework will be articulated in a series of phases that have to be considered in the change process within an ecosystem. For each phase, the research will present the most common issues faced by organizations together with the corresponding change management actions. These actions are categorized in short-term and long-term. Moreover, the paper provides a set of indicators that can be used to monitor the effectiveness of the various change management actions. Finally, the validity of the change management framework will be proved thanks to its application in a project of digital innovation in healthcare domain. This analysis will provide a concrete example on how change management can be accomplished throughout a specific digital ecosystem.","Proceedings of the European Conference on Innovation and Entrepreneurship, ECIE",2021-01-01,10.34190/EIE.21.077,0.6415736656799358
A healthcare logistic network considering stochastic emission of contamination: Bi-objective model and solution algorithm,"This paper presents a novel healthcare waste location-routing problem by concentrating on a new perspective in healthcare logistics networks. In this problem, there are healthcare, treatment, and disposal centers. Locations of healthcare centers are known, however, it is required to select appropriate locations for treatment, recycling, and disposal centers. Healthcare wastes are divided into infectious and non-infectious wastes. Since a great volume of healthcare wastes are infectious, the emission of contamination can have obnoxious impacts on the environment. The proposed problem considers a stochastic essence for the emission of contamination which depends on the transferring times. In this respect, transferring times between healthcare and treatment centers have been considered as normal random variables. As transferring time increases, it is more likely for the contamination to spread. Having visited a treatment center, infectious wastes are sterilized and they will no longer be harmful to the environment. This research develops a bi-objective mixed-integer mathematical formulation to tackle this problem. The objectives of this model are minimization of total costs and emission of contamination, simultaneously. Complexity of the proposed problem led the researchers to another contribution. This study also develops a Multi-Objective Water-Flow like Algorithm (MOWFA), which is a meta-heuristic, to solve the problem. This algorithm uses a procedure based on the Analytical Hierarchy Process (AHP) to rank the non-dominated solutions in the archive set. By means of a developed mating operator, the MOWFA utilizes the best ranked solutions of the archive in order to obtain high quality offspring. Two neighborhood operators have been designed for the MOWFA as the local search methods. Extensive computational experiments have been conducted to evaluate the effectiveness of the MOWFA on several test problems compared with other meta-heuristics, namely the Multi-Objective Imperialist Competitive Algorithm (MOICA) and Multi-Objective Simulated Annealing (MOSA). These experiments also include a real healthcare waste logistic network in Iran. The computational experiments demonstrate that our proposed algorithm prevails these algorithms in terms of some well-known performance evaluation measures.",Transportation Research Part E: Logistics and Transportation Review,2020-10-01,10.1016/j.tre.2020.102060,0.6396015088763981
Handling uncertainty in the specification of autonomous multi-robot systems through mission adaptation,"Multi-robot systems (MRS) have gained interest as a versatile paradigm for complex task execution across various domains such as healthcare, logistics, and maintenance. Often, they are called to operate in variable and dynamic environments, which makes uncertainties arise and affect those systems. Uncertainties require the system to be able to adapt its behavior at runtime, in response to the changing and unpredictable conditions in its operating environment. Moreover, often the behavior of the robots cannot be completely anticipated at design time. Consequently, static mission planning is not always suitable: mission specifications need to take into account the uncertainties and, hence, be dynamic and re-configurable at runtime, when the required knowledge is available.This work focuses on the realization of adaptable multi-robot systems, which are capable of dealing with uncertainties by adapting their mission at runtime. We introduce the concept of ""adaptable task"" that is used in the global mission specification of the MRS to identify the mission tasks affected by uncertainties. Adaptation alternatives are modeled as sub-missions and associated with the adaptable task. At runtime, ad hoc written ""trigger functions"" executed by robots sense and evaluate the environment and select the most suitable adaptation alternative to be executed.We have experimented with the approach by simulating a use case to assess its validity. The system was able to adapt its behavior in response to the environmental conditions, thus allowing the fulfillment of the mission goals. We also discuss the applicability of the use case on a set of known single- and multi-robot systems.","Proceedings - 2024 IEEE/ACM 19th Symposium on Software Engineering for Adaptive and Self-Managing Systems, SEAMS 2024",2024-04-15,10.1145/3643915.3644099,0.6264783340404614
Logistics chain optimization and scheduling of hospital pharmacy drugs using genetic algorithms: Morocco case,"In recent years, the health sector has faced increasingly important challenges. Due to the economic crisis and competitions, hospitals are facing many issues affecting the supply chain, such as budget cuts or lack thereof as well as insufficient human resources. Although essential for an excellent service, logistics take up a considerable part of the budget as challenges need to be addressed such as delays in drugs delivery, transportation and storage conditions, routing and scheduling. As to governance, each hospital is assigned to a specific region, which cannot be defined due to political, demographic, or geographic issues. This paper focuses on multi-depot vehicle routing problem (MDVRP) in healthcare logistics to feed the hospital pharmacies. The idea is to apply MDVRP’s approach to the health sector, specifically hospital pharmacies. In this projection, hospitals are considered to present clients, and central pharmacies present deposits. This problem (the MDVRP) is known by this nature NP-hard. For that, the heuristic method was used as genetic algorithm to solve the problem. The paper is organized as follows, the first section discusses, compares, and proposes clustering methods for healthcare facilities with applying them on Moroccan hospitals case; the second section proposes a genetic algorithm to resolve the MDVRP with a simulation.",International Journal of Web-Based Learning and Teaching Technologies,2021-03-01,10.4018/IJWLTT.2021030104,0.6209872241522425
Design an Indoor Positioning System Using ESP32 Ultra-Wide Band Module,"In recent years, Indoor Positioning Systems have always captivated a colossal repercussion on many end-user applications such as medical healthcare, logistic and warehouse, smart buildings, military, etc. In particular, indoor tracking often requires high accurate localization. However, positioning precision is restricted by various hindrances within the mise-en-scène, especially the Non-Line-Of-Sight context which affects signal dispersion and occlusions. The proliferation of numerous RF technologies, such as RFID, WiFi, Bluetooth or Zigbee, etc. facilitates users to detect an object’s location within a peculiar range. Consequently, in the scope of this paper, a short-range technology system is developed for indoor positioning. The system is exploited properly to trail an object equipped with a small tag using Ultra-Wide Band module as ESP32. For the exact localization of the matter, the method measures the running time of wave between the object and at least two receivers (called bilateration). Also, the model is validated through a good accordant comparison between simulation and experimental results.",Lecture Notes on Data Engineering and Communications Technologies,2023-01-01,10.1007/978-3-031-46573-4_35,0.6124768613826707
A simulation model to analyse automation scenarios in decontamination centers,"Decontamination centres provide sterilisation services (sort, disinfect, package, and sterilise) for reusable surgical instruments that have a vital impact on patient safety. The market trend is to increase the level of automation in the decontamination process, to increase productivity, and reduce the risk of human error and musculoskeletal injuries. The goal of this research is to study the use of automated guided vehicles (AGVs) in sterilisation departments, to improve safety and efficiency. A generic simulation model is created based on data gathering of various decontamination centres and is validated for a specific centre to analyse various aspects of applying AGVs to automate the internal transfer. Centre’s potential to increase capacity through AGV application is analysed and a Design of Experiments is conducted to identify the most promising implementation scenarios. Results show reductions in treatment time and work in process, while,maintaining the accessibility of medical instruments, and ensuring worker safety.",Health Systems,2023-01-01,10.1080/20476965.2021.2004933,0.6107987942766475
Reorganisation of the internal storage and distribution logistics in a hospital,"This study involved the analysis and improvement of the internal distribution and storage at Hospital da Senhora da Oliveira - Guimaraes, a 500-beds general hospital in the north of Portugal. The study evolved around an action-research strategy that comprised five sequential and interconnected phases. Initially, the internal supply chain of the hospital was analysed with a special focus on ward warehouses (WW) and data about the logistics processes of the WW were gathered. Following, a prototype WW to test a set of innovative solutions aimed at dealing with the difficulties identified in the previous phase was developed. The proposed improvements were analysed and then implemented in the WW of a health care department, which lead to a new data collection about the performance of the logistics processes. The implementation of the proposed solutions resulted in a reduction of the time spent collecting, debiting and storing materials of 55% to 66%. It was also possible to reduce the error rate in these processes by 93%. When the proposed solutions are expanded to the whole hospital, in a year, it will be possible to save 4,819 hours in WW logistics processes (that can be dedicated to provide care to patients) and to avoid 115,843 errors",Procedia Computer Science,2023-01-01,10.1016/j.procs.2023.01.421,0.6036394773427329
Six Sigma Application in Healthcare Logistics: A Framework and A Case Study,"Six Sigma is used heavily in various industrial sectors, yet no noticeable applications are seen in healthcare logistics. This paper reveals the special case of healthcare logistics where cost reduction is not the only factor considered in project selection; performance and criticality of each item in the logistics system are of high importance as well. This paper provides a proposed framework to apply Six Sigma in the area of healthcare logistics. It also presents a case study implementing the proposed framework at a Jordanian hospital. In the case study, the paper reveals how the modifications of the define phase to take into consideration the criticality, cost, and performance of items make typical Six Sigma methodology very beneficial for healthcare logistics. In addition, it shows how the Six Sigma project selection can be done to deal effectively with healthcare logistics issues. This paper paves the road for research to elaborate on ways to use Six Sigma in the area of improving healthcare logistics.",Journal of Healthcare Engineering,2019-01-01,10.1155/2019/9691568,0.5979440932891434
"Correction to: A systematic literature review of simulation models for non-technical skill training in healthcare logistics (Advances in Simulation, (2018), 3, 1, (15), 10.1186/s41077-018-0072-7)","The original article [1] contains a previous iteration of author, Chen Zhang’s name. This should instead be displayed as Cevin Zhang as shown in this Correction article.",Advances in Simulation,2019-12-01,10.1186/s41077-019-0094-9,0.5979353461907702
Critical-to-life classification for managing inventory in a healthcare supply chain,"This paper presents a multi-criterion critical-to-life classification technique to supplement the cost and usage measures that are normally employed in hospital inventory management. A system dynamics model was developed employing (R, s, S) inventory control approach for a US private sector healthcare supply chain. Extensive simulation analyses were conducted to study the stock behaviour for low, medium and high usage critical-to-life items to maintain a range of service levels. The (R, s, S) design parameters were optimised according to the variability of item usage, the associated inventory level and supply lead-time. Our findings suggest that the proposed inventory classification technique allows for assigning a particular service level to each critical-to-life item to ensure its availability while minimising the cost and stock-out situations. The proposed simulation tool incorporating critical-to-life inventory classification facilitates hospital logistics managers to devise efficient inventory control strategies based on critical-to-life service level index.",International Journal of Intelligent Enterprise,2015-01-01,10.1504/IJIE.2015.073491,0.5925785658525886
The COVID-19 pandemic and follow-up for shoulder surgery: The impact of a shift toward telemedicine on validated patient-reported outcomes,"Introduction: The emergence of COVID-19 and its ensuing restrictions on in-person healthcare has resulted in a sudden shift towards the utilization of telemedicine. The purpose of this study is to assess patient satisfaction and patient-reported outcome measures (PROMs) for individuals who underwent follow-up for shoulder surgery using telemedicine compared to those who received traditional in-person clinic follow-up. Methods: Patients who underwent either rotator cuff repair or total shoulder arthroplasty during a designated pre-COVID-19 (traditional clinic follow-up) or peri-COVID-19 (telemedicine follow-up) span of time were identified. PROMs including the American Shoulder and Elbow Surgeons standardized assessment form, the three-level version of the EQ-5D form, the 12-Item Short Form survey, and a modified version of a published telemedicine survey were administered to participants six months post-operatively via phone call. Results: Sixty patients agreed to participate. There was no significant difference between the pre-COVID-19 and peri-COVID-19 groups in patient satisfaction with their follow-up visit (p = 0.289), nor was there a significant difference in PROMs between the two groups. In total, 83.33% of the telemedicine group and 70.37% of the in-person clinic group preferred traditional in-person follow-up over telemedicine. Discussion: In a cohort of patients who underwent telemedicine follow-up for shoulder surgery during the COVID-19 pandemic, there was no difference in patient satisfaction and PROMs compared to traditional in-person clinic follow-up. This study indicates that while the majority of participants preferred face-to-face visits, patients were relatively satisfied with their care and had similar functional outcome scores in both groups, despite the large disruption in healthcare logistics caused by COVID-19.",Journal of Telemedicine and Telecare,2023-07-01,10.1177/1357633X21990997,0.5902866074256828
ONLINE CAPACITY PLANNING for REHABILITATION TREATMENTS: AN APPROXIMATE DYNAMIC PROGRAMMING APPROACH,"We study an online capacity planning problem in which arriving patients require a series of appointments at several departments, within a certain access time target. This research is motivated by a study of rehabilitation planning practices at the Sint Maartenskliniek hospital (the Netherlands). In practice, the prescribed treatments and activities are typically booked starting in the first available week, leaving no space for urgent patients who require a series of appointments at a short notice. This leads to the rescheduling of appointments or long access times for urgent patients, which has a negative effect on the quality of care and on patient satisfaction. We propose an approach for allocating capacity to patients at the moment of their arrival, in such a way that the total number of requests booked within their corresponding access time targets is maximized. The model considers online decision making regarding multi-priority, multi-appointment, and multi-resource capacity allocation. We formulate this problem as a Markov decision process (MDP) that takes into account the current patient schedule, and future arrivals. We develop an approximate dynamic programming (ADP) algorithm to obtain approximate optimal capacity allocation policies. We provide insights into the characteristics of the optimal policies and evaluate the performance of the resulting policies using simulation.",Probability in the Engineering and Informational Sciences,2020-07-01,10.1017/S0269964818000402,0.5900502754837847
Association of open communication and the emotional and behavioural impact of medical error on patients and families: state-wide cross-sectional survey,"Background How openly healthcare providers communicate after a medical error may influence long-term impacts. We sought to understand whether greater open communication is associated with fewer persisting emotional impacts, healthcare avoidance and loss of trust. Methods Cross-sectional 2018 recontact survey assessing experience with medical error in a 2017 random digit dial survey of Massachusetts residents. Two hundred and fifty-three respondents self-reported medical error. Respondents were similar to non-respondents in sociodemographics confirming minimal response bias. Time since error was categorised as <1, 1–2 or 3–6 years before interview. Open communication was measured with six questions assessing different communication elements. Persistent impacts included emotional (eg, sadness, anger), healthcare avoidance (specific providers or all medical care) and loss of trust in healthcare. Logistic regressions examined the association between open communication and long-term impacts. Results Of respondents self-reporting a medical error 3–6 years ago, 51% reported at least one current emotional impact; 57% reported avoiding doctor/facilities involved in error; 67% reported loss of trust. Open communication varied: 34% reported no communication and 24% reported ≥5 elements. Controlling for error severity, respondents reporting the most open communication had significantly lower odds of persisting sadness (OR=0.17, 95% CI 0.05 to 0.60, p=0.006), depression (OR=0.16, 95% CI 0.03 to 0.77, p=0.022) or feeling abandoned/betrayed (OR=0.10, 95% CI 0.02 to 0.48, p=0.004) compared with respondents reporting no communication. Open communication significantly predicted less doctor/facility avoidance, but was not associated with medical care avoidance or healthcare trust. Conclusions Negative emotional impacts from medical error can persist for years. Open communication is associated with reduced emotional impacts and decreased avoidance of doctors/facilities involved in the error. Communication and resolution programmes could facilitate transparent conversations and reduce some of the negative impacts of medical error.",BMJ Quality and Safety,2020-01-20,10.1136/bmjqs-2019-010367,0.5827849756958448
TOWARD MORE REALISTIC SIMULATION MODELS USING OBJECT-CENTRIC PROCESS MINING,"Discrete-event simulation has been around for over half a century with applications in production, healthcare, logistics, transportation, etc. However, it is still challenging to create a reliable simulation model that mimics the actual process well and allows for “what-if” questions. Process mining allows for the automated discovery of stochastic process models using event data extracted from information systems. This technology is one of the key enablers for creating digital shadows and digital twins of operational processes. However, traditional process mining focuses on individual cases (e.g., an order, a patient, or a train) with events just referring to a single object (the case). Therefore, the discipline is moving to Object-Centric Process Mining (OCPM), where events can refer to any number of objects. Based on research on OCPM and the prototypes developed, now also commercial software vendors are embracing OCPM, as illustrated by Celonis Process Sphere, which allows for the discovery and analysis of object-centric process models. We believe that OCPM will help to create much more realistic simulation models. Whereas process discovery is backward-looking, with object-centric simulation models, we can also support forward-looking forms of process mining. Although such techniques still need to be developed, they provide a unique opportunity to create more realistic digital twins of organizations and their processes.","Proceedings - European Council for Modelling and Simulation, ECMS",2023-01-01,,0.5792026682683341
A Decision Support Tool for the Location Routing Problem During the COVID-19 Outbreak in Colombia,"During the outbreak of coronavirus disease 2019 (COVID-19) in Bogotá, Colombia, some strategies for dealing with the increasing number of infected people and the level of occupation of intensive care units include the use of Personal Protective Equipment (PPE). PPE is a crucial component for patient care and a priority for protecting healthcare workers. For attending this necessity, the location of distribution centers within the city and the corresponding routes to supply the intensive care units (ICU) with PPE have an important role. Formally, this problem is defined as the Location Routing Problem (LRP). The LRP is an NP-Hard problem that combines the Facility Location Problem (FLP) and the Vehicle Routing Problem with Multiple Depots (MDVRP). This work presents a decision support tool based on a simheuristic method that hybridize an Iterated Local Search (ILS) algorithm with Monte Carlo simulation to deal with the LRP with uncertain demands. Realistic data from Bogotá (Colombia) was retrieved using Google Maps to characterize the geographical distribution of both potential facilities and ICUs, while demands were generated using the uniform probability distribution. Our preliminary results suggest the competitiveness of the algorithm in both the deterministic and the stochastic versions of the LRP.",Communications in Computer and Information Science,2021-01-01,10.1007/978-3-030-76310-7_3,0.5765737556499151
