Title,Abstract,Journal,Publishing Date,DOI
Role of Hospital Digital Services in Improvement of Clinical Regime of Patients,"Context: Healthcare supply chain management is the regulation of the flow of medical goods and services frommanufacturers to patients. Supply chain management encompasses the planning and managing of all activities involved in sourcing and procurement, conversion, and all logistics management activities. Therefore, it greatly helps material managers to manage through continuous improvement efforts while maintaining the quality of care. Moreover, reinforcing healthcare logistics information technology (IT) architecture immediately leads to more patient satisfaction. Objectives: This study aimed to develop an architecture for designing efficient software aiding with the management of the healthcare supply chain. Methods: This study showed the role of digital services in the improvement of the clinical regime of patients by presenting different approaches with distinguishing the main types of hospital logistics, such as physical flow management, food safety, and cold chain management approaches (e.g., “moving forward”), and modeling these components using the solution architecture principles of ITs, such as Business Process Model and Notation. Results: This study proposed a hospital enterprise architecture by modeling a system to have a base for building a digital catering service that improves the clinical regime of patients.",Health Technology Assessment in Action,2021-01-01,10.18502/htaa.v5i1.7381
Artificial Intelligence for Healthcare Logistics: An Overview and Research Agenda,"In this chapter we present the existing literature on machine learning approaches and artificial intelligence for logistical problems arising for designing, providing and improving healthcare services. As a basis, we provide a framework for the classification of artificial intelligence. For the analysis, we distinguish between the care levels (primary, secondary and tertiary care), the planning levels (strategic, tactical and operational), as well as the user types (doctors, nurses, technicians, patients, etc.). Based on the results, we provide a research agenda with open topics and future challenges.",Artificial Intelligence and Data Mining in Healthcare,2021-01-01,10.1007/978-3-030-45240-7_1
"Intelligent Connectivity: AI, IoT, and 5G","Intelligent Connectivity: AI, IoT, and 5G delivers a comprehensive technological and economic analysis of intelligent connectivity and the integration of artificial intelligence, Internet of Things (IoT), and 5G. It covers a broad range of topics, including Machine-to-Machine (M2M) architectures, edge computing, cybersecurity, privacy, risk management, IoT architectures, and more. The book offers readers robust statistical data in the form of tables, schematic diagrams, and figures that provide a clear understanding of the topic, along with real-world examples of applications and services of intelligent connectivity in different sectors of the economy. Intelligent Connectivity describes key aspects of the digital transformation coming with the 4th industrial revolution that will touch on industries as disparate as transportation, education, healthcare, logistics, entertainment, security, and manufacturing. Readers will also get access to: A thorough introduction to technology adoption and emerging trends in technology, including business trends and disruptive new applications Comprehensive explorations of telecommunications transformation and intelligent connectivity, including learning algorithms, machine learning, and deep learning Practical discussions of the Internet of Things, including its potential for disruption and future trends for technological developmentIn-depth examinations of 5G wireless technology, including discussions of the first five generations of wireless techIdeal for telecom and information technology managers, directors, and engineers, Intelligent Connectivity: AI, IoT, and 5G is also an indispensable resource for senior undergraduate and graduate students in telecom and comp uter science programs.","Intelligent Connectivity: AI, IoT, and 5G",2021-01-01,10.1002/9781119685265
Improving operational efficiency of pharmaceutical inventory,"The pharmaceutical inventory is one of the significant parts involved in hospital operations. However, the limitation of inventory space causes the complexity of inventory control. The purpose of this research is to improve the efficiency of Maharaj Nakorn Chiang Mai Hospital’s Pharmaceutical Inventory. The principle of ABC-VED Classification is applied in this research to prioritize the medicine inventory. Moreover, the optimal number of inventory is defined using Economic Order Quantity (EOQ), Safety Stock (SS), and Reorder Point (ROP). The result of the developed models can reduce the total cost by 17.62%, medicine storage by 64.40% and medicine shortages.",Proceedings of the International Conference on Industrial Engineering and Operations Management,2021-01-01,
Hybrid predetection technique for efficient tag identification in radio-frequency identification systems,"Radio-frequency identification (RFID) is a noncontact automatic identification technology that has been widely used in various modern industries. Due to the continuous improvement in sensing capabilities, energy autonomy, affordability, and usability, RFID is one of the key enabling technologies in realizing the Internet of Things (IoT). With their non-line-of-sight wireless transmission, wireless power, and sensing capability, lightweight RFID sensor tags can be connected to people or objects, which is crucial for future IoT applications such as healthcare, logistics, and manufacturing. The RFID approach with the simultaneous reading of multiple tag features can quickly identify connected “things” for further data communication and integration. Reducing the identification processing time for many tags located inside the interrogation range of the reader is essential. Therefore, an effective protocol must be developed to prevent collisions and reduce useless queries between the reader and tags to achieve rapid identification. Predetection tree-based algorithms, which are based on certain small predetection timeslots that tags can respond to, can eliminate unnecessary idle slots and prevent collision slots. In this paper, an efficient predetection-based anticollision algorithm has been proposed to achieve outstanding tag identification performance. The numbers of collision slots and idle slots are reduced by exploiting a novel predetection mechanism and slot size adjustment technique. Simulation results indicate that the proposed scheme reduces the tag identification time by approximately 30-60% compared with previously proposed predetection-based protocols. Moreover, the numbers of query cycles, collisions, and slots are smaller in the proposed scheme than in the previously proposed protocols.",Sensors and Materials,2021-01-01,10.18494/SAM.2021.3381
A Mobile Healthcare Service Routing and Scheduling Problem in Rural Areas,"A change in health policy become essential since healthcare needs of societies have changed over the past sixty years. It is not possible to build a hospital wherever people live especially in less populated settlements. However, equal access of people to health services must be ensured by governments. To tackle this issue, Turkey Ministry of Health has enforced to give mobile healthcare services in rural areas by approximately 7.5 thousand doctors located in 3.4 thousand medical centers. These doctors work 8 h/day and give mobile healthcare service to approximately 9 million people each month. This study considers Turkey rural healthcare delivery system as a Multi-depot Time Constrained Periodic Vehicle Routing Problem (md-TCPVRP) and presents a mixed-integer linear programming formulation for the problem. The goal is to derive daily routes of the doctors each month, under some constraints such as maximum workhours, route duration, minimum service time per visit, assigning dedicated doctors to villages while minimizing the total route distance. In order to investigate the performance of the model a computational experiment is carried. The real-life application of Health Directorate of the province and proposed mathematical model results are compared. Computational results show significant improvements in total distances.",Lecture Notes on Data Engineering and Communications Technologies,2021-01-01,10.1007/978-3-030-79203-9_11
A Decision Support Tool for the Location Routing Problem During the COVID-19 Outbreak in Colombia,"During the outbreak of coronavirus disease 2019 (COVID-19) in Bogotá, Colombia, some strategies for dealing with the increasing number of infected people and the level of occupation of intensive care units include the use of Personal Protective Equipment (PPE). PPE is a crucial component for patient care and a priority for protecting healthcare workers. For attending this necessity, the location of distribution centers within the city and the corresponding routes to supply the intensive care units (ICU) with PPE have an important role. Formally, this problem is defined as the Location Routing Problem (LRP). The LRP is an NP-Hard problem that combines the Facility Location Problem (FLP) and the Vehicle Routing Problem with Multiple Depots (MDVRP). This work presents a decision support tool based on a simheuristic method that hybridize an Iterated Local Search (ILS) algorithm with Monte Carlo simulation to deal with the LRP with uncertain demands. Realistic data from Bogotá (Colombia) was retrieved using Google Maps to characterize the geographical distribution of both potential facilities and ICUs, while demands were generated using the uniform probability distribution. Our preliminary results suggest the competitiveness of the algorithm in both the deterministic and the stochastic versions of the LRP.",Communications in Computer and Information Science,2021-01-01,10.1007/978-3-030-76310-7_3
Intellectual property issues in artificial intelligence: Specific reference to the service sector,"Artificial intelligence (AI) has transformed almost every field of the service sector, such as finance, healthcare logistics, automotive and aviation. The innovative technologies can identify uneven patterns like spam filtering or payment deceit, and make aware businesses in actual time about questionable activities, hence are helpful in the growth of a market. These innovation and creation are protected under different forms of intellectual property (IP). However, the transformation from AI related inventions to AI lead inventions has raised substantial challenges to the existing IP infrastructure. This study aims at looking into different aspects of AI related IP protection with an elaborative analysis of the patenting trends through landscape analysis of AI in the service sector. It is observed that AI is playing a pivotal role in the transformation of the service sector due to its accelerating use. But the issues related to legal and ethical need to be addressed for effective utilisation of AI related invention and creation in the service sector.","International Journal of Technological Learning, Innovation and Development",2021-01-01,10.1504/IJTLID.2021.114920
Healthcare Logistics Optimization Framework for Efficient Supply Chain Management in Niger Delta Region of Nigeria,"Optimizing logistics allocation and utilization is essential for effective healthcare management. Apparently, less consideration is given to it in most hospitals in Nigeria where less resources are allocated to health sector in yearly budgetary. Hospital consists of several patient classes, each of which follows different treatment process flow paths over a multiphase and multidimensional requirement with scarce resources and inadequate space. Despite the small budget provision made for healthcare resources, patient’s demands for better service is rapidly experiencing upsurge. Hence, efficient and optimal solutions are required to lessen costs of healthcare service towards enhancing Quality of Care (QoC) and Quality of Experience (QoE) in most public healthcare sector. However, certain control coefficients like the absence of a Dedicated Logistics Department (DLD) in the medical facilities actually limit the efforts of stakeholders. This paper proposed a Computational framework to assess various strategic and operational decisions for optimizing the multiple objectives using Type-1 Fuzzy Logic Model. In phase I, we explore healthcare resource allocation plan. In phase II, we determine a resource utilization schedule by patient class for daily operational level. While in Phase III, we develop a framework capable of evaluating and optimizing healthcare logistics using control coefficients of Logistics Optimization (LO), Integration of Information/Cognitive Technologies (ETA), and Collaboration of all Logistics Stakeholders (COL). We assigned weights between 1 and 10 to the coefficients and modeled the effects on efficient supply chain. Finally, we further explore the effects of separate strategies and their combination to identify the best possible resource supply chain. The computational experiment was considered on the basis of data obtained from a study conducted on a typical public healthcare department. Results shows that our approach significantly evaluate and optimized healthcare logistics.",International Journal of Advanced Computer Science and Applications,2021-01-01,10.14569/IJACSA.2021.0120475
Transporting COVID-19 testing specimens by routing unmanned aerial vehicles with range and payload constraints: the case of Istanbul,"This paper aims to emphasize the impacts of the COVID-19 pandemic at the healthcare logistics and supply chain networks and to transport polymerase chain reaction testing samples between hospitals and laboratories by using unmanned aerial vehicles (UAVs). To achieve the mission, range and payload capacitated UAV routing problem is defined and a mixed-integer linear programming model (MILP) is developed. The MILP model aims to decide the requisite quantity of the UAVs and to minimize the total transportation distance while satisfying the predetermined constraints. As a real-life instance, the healthcare network of Istanbul is selected and the network includes 219 hospitals and 23-unit basic testing laboratories for the COVID-19 pandemic. The results indicated that the proposed optimization model can find the needed number of UAVs with the minimum tour distances in reasonable run times and achieves to transport 25,000 testing specimens between hospitals and laboratories via UAVs.",Transportation Letters,2021-01-01,10.1080/19427867.2021.1896063
A quickly deployed and UAS-based logistics network for delivery of critical medical goods during healthcare system stress periods: A real use case in Valencia (Spain),"On the one hand, Unmanned Aircraft Systems (UASs) have experienced great applicability surge in the recent years, arising as a promising technology with a wide field of use. On the other hand, healthcare, a critical system in modern society, is subject to a heavy and unexpected pressure in the case of situations such as the COVID-19 pandemic. This article aims to leverage the flexibility of UASs as complementary support for healthcare logistic systems when under high-stress conditions, via quick deployment of an air delivery network. We have defined a logistics network model and created three scenarios based on the model and current needs in Valencia (Spain). Flight tests have been performed in these scenarios, which include urban areas and controlled airspace. Operations complied with requirements derived from the application of Specific Operations Risk Assessment (SORA) methodology, recently adopted by the European Aviation Safety Agency (EASA). Flights were successful, being able to swiftly deliver medical goods without requiring any dedicated infrastructure. However, a moderate number of contingencies took place during the tests, mainly related to control link quality and Air Traffic Management (ATM) integration, forcing the use of dedicated procedures to cope with them. Although additional development is required to ensure the safety of large-scale automated operations, the use of UASs as part of logistic networks is a feasible means to support existing structures, especially in situations in dire need.",Drones,2021-01-01,10.3390/DRONES5010013
Statistical assessment of hybrid blockchain for sme sector,"Blockchain innovation with its property of immutable data isn't just limited to digital cryptographic forms of money yet in addition for various domains like healthcare, logistics, rentals, entertainment, social media and so on. Ventures are investigating this innovation to adopt in main line of business, which will give certainty on security ceasing data breach. This research paper has built up a hybrid blockchain framework which can be utilized on premise or over the cloud or a combination of both and can be utilized by various departments for protecting transactions in small and medium scale businesses with an uprightness of high security, transparency, remote devices, accessibility and cost adequacy. This created framework compares with the traditional approach model on some significant factors for statistical assessment. The analysis discovers how this hybrid blockchain framework is more productive and secured than the client server approach model and aims to be utilized as platform as a service both in local or hybrid cloud infrastructure.",WSEAS Transactions on Systems and Control,2021-01-01,10.37394/23203.2021.16.6
Healthcare services: A systematic review of patient-centric logistics issues using simulation,"Healthcare has material-centric external and patient-centric internal logistics. Researchers widely use simulation approaches to model healthcare internal logistics due to the problem complexity. There is a need to map the existing knowledge base to systematically identify the emerging research themes of this domain. This work presents a systematic literature review to identify the patient-centric logistics issues in healthcare modelled using simulation. In all, 583 papers published from 2008 to 2017 in the Clarivate Analytics Web of Science database have been collected; 238 articles were shortlisted for the review. Using keyword co-occurrence and cluster analysis, thirteen research clusters are identified, with eight of them central to the research domain and deserving further attention. Among the simulation approaches, discrete event simulation is most prevalent followed by hybrid approaches (that use two or more simulation techniques or simulation combined with analytical methods), system dynamics, agent-based simulation, and Monte Carlo simulation.",Journal of the Operational Research Society,2021-01-01,10.1080/01605682.2020.1790306
A multi-agents system for solving facility layout problem: Application to operating theater,"Facility layout problem (FLP) has a great impact on the efficiency of any organization. It is concerned with defining the optimal location for each facility in order to optimize the supply chain productivity. In this kind of problems, the choice of resolution approach depends on the complexity and the size of the problem. Operating theaters are generally big structures containing a lot of facilities, which makes the conception of their layout a complex problem. In the literature, exact methods are powerless when faced with problem sizes up to 18 facilities. This leads us to explore other approaches, looking for efficient solutions. This paper presents a novel approach using a multi-agents system where agents' skills are exploited to cover a wide research space, to accelerate the decision-making process and to deal with real-life problem sizes. This decision-making tool is based on several mixed integer linear programming models for solving the FLP, and considers two types of environments with deterministic and variant patient demand. Several experiments have been performed to demonstrate the effectiveness of our approach, and several problem instances with >80 facilities have been solved in reasonable time.",Journal of Intelligent Systems,2021-01-01,10.1515/jisys-2017-0081
A healthcare logistic network considering stochastic emission of contamination: Bi-objective model and solution algorithm,"This paper presents a novel healthcare waste location-routing problem by concentrating on a new perspective in healthcare logistics networks. In this problem, there are healthcare, treatment, and disposal centers. Locations of healthcare centers are known, however, it is required to select appropriate locations for treatment, recycling, and disposal centers. Healthcare wastes are divided into infectious and non-infectious wastes. Since a great volume of healthcare wastes are infectious, the emission of contamination can have obnoxious impacts on the environment. The proposed problem considers a stochastic essence for the emission of contamination which depends on the transferring times. In this respect, transferring times between healthcare and treatment centers have been considered as normal random variables. As transferring time increases, it is more likely for the contamination to spread. Having visited a treatment center, infectious wastes are sterilized and they will no longer be harmful to the environment. This research develops a bi-objective mixed-integer mathematical formulation to tackle this problem. The objectives of this model are minimization of total costs and emission of contamination, simultaneously. Complexity of the proposed problem led the researchers to another contribution. This study also develops a Multi-Objective Water-Flow like Algorithm (MOWFA), which is a meta-heuristic, to solve the problem. This algorithm uses a procedure based on the Analytical Hierarchy Process (AHP) to rank the non-dominated solutions in the archive set. By means of a developed mating operator, the MOWFA utilizes the best ranked solutions of the archive in order to obtain high quality offspring. Two neighborhood operators have been designed for the MOWFA as the local search methods. Extensive computational experiments have been conducted to evaluate the effectiveness of the MOWFA on several test problems compared with other meta-heuristics, namely the Multi-Objective Imperialist Competitive Algorithm (MOICA) and Multi-Objective Simulated Annealing (MOSA). These experiments also include a real healthcare waste logistic network in Iran. The computational experiments demonstrate that our proposed algorithm prevails these algorithms in terms of some well-known performance evaluation measures.",Transportation Research Part E: Logistics and Transportation Review,2020-10-01,10.1016/j.tre.2020.102060
Support of the logistics chain by small aircraft in times of emergency,"Healthcare logistics, which is primarily aimed at patient care, represents a number of activities in the area of supply chain management. Hospitals are a key link in the supply chain, where they are the end customer, the supply chain from the manufacturer through all bottlenecks. A complete description of the distribution of medical supplies can be summarized into an external and internal supply chain. The external circuit represents the supply of the necessary commodities and ends at the distribution point. The internal circuit continues to the nursing units of the hospital supply chain. Currently, two basic forms are used for the distribution of supplies to the level of nursing units, through the regions, or through the supply from the humanitarian warehouse. The acquisition, storage, and distribution processes depend on the material availability on the market and the level of the maintained stocks. Modern technologies enable continuous collection of requirements and are the basis of a proactive approach to the solution, which allows the use of all accessible air transport, military and civilian capabilities, according to the criteria of the user or end customer.","NTinAD 2020 - New Trends in Aviation Development 2020 - 15th International Scientific Conference, Proceedings",2020-09-17,10.1109/NTAD51447.2020.9379077
