Title,Abstract,Journal,Publishing Date,DOI
Hospital Capacity Planning for Special Economic Zone in Thailand: A Case Study in Kanchanaburi Province,"Increasing the employment demand in a particular region has an impact on the healthcare system due to types of occupational diseases/injuries and number of workers. Kanchanaburi Province, Thailand, is one of target areas to launch special economic zone (SEZ), which will cause dramatic population growth. Thus the aim of this research is to propose hospital capacity planning in Kanchanaburi taking into account the upcoming SEZ. This study employs a two-stage approach for data collection and validation. Firstly, interview and focus group is used to gather all related healthcare logistic issues. Then hospital's capacity is forecasted based on target health provider-topopulation ratios. The results show that current healthcare services in Kanchanaburi will not be sufficient to support the projected population.",IEEE International Conference on Industrial Engineering and Engineering Management,2018-07-02,10.1109/IEEM.2018.8607755
Multicommodity flows and Benders decomposition for restricted continuous location problems,"The restricted continuous facility location problem arises when there is a need to locate a number of facilities to serve a discrete set of demand points, and where the location of a facility can be anywhere on the plane except for in restricted regions. The problem finds applications in urban planning, disaster management, and healthcare logistics. The restricted regions can occur randomly or are known in advance. The paper describes a new model for the problem that is based on multicommodity flows with unknown destinations and defined on a discretization of the plane. The model and discretization are applied to both the deterministic and the stochastic continuous restricted location problem, where the latter is converted into a deterministic equivalent problem by minimizing the expected value of the objective function weighted by the probabilities of scenarios. The paper also describes a Benders decomposition algorithm to optimally solve the model. Extensive computational results are presented on both benchmark instances from the literature and new instances, on both the deterministic and stochastic variant of the problem. The results indicate that the proposed algorithm is superior to an off-the-shelf solver in terms of computational time. To the best of the authors’ knowledge, the exact algorithm described here is the first to address both the deterministic and the stochastic variants of continuous restricted location problems with any number of facilities.",European Journal of Operational Research,2018-05-01,10.1016/j.ejor.2017.11.033
Healthcare logistics and supply chain – Issues and future challenges,,Supply Chain Forum,2018-01-01,10.1080/16258312.2018.1433353
Develop a strategy for improving healthcare logistics performance,"Recently, there has been a great interest in applying logistics and supply chain management practice and strategy in healthcare services. This paper proposes a strategy for improving healthcare logistics performance. Eighteen hospitals located in different countries, namely Laos, Malaysia, Myanmar, Singapore, and Thailand, were interviewed about their national and operational performance. The tool for assessing national healthcare performance, that is, the Health Metric Network framework, developed by the World Health Organization in 2008 was applied to assess the healthcare logistics infrastructure of those countries. Furthermore, we developed set of logistics performance indicators at the operational level. The Analytical Network Process methodology was used to develop the hierarchical measurement for those operational healthcare logistics performances. The results show interdependencies between operational and national performance. The operational performance is affected by the country’s environment. Finally, a strategy for improving healthcare logistics performance is proposed. The interdependences between operational and national performance are discussed.",Supply Chain Forum,2018-01-01,10.1080/16258312.2017.1416876
Healthcare logistics in disaster planning and emergency management: A perspective,"This paper discusses the role of healthcare supply chain management in disaster mitigation and management. While there is an abundance of literature examining emergency management and disaster preparedness efforts across an array of industries, little information has been directed specifically toward the emergency interface, interoperability and unconventional relationships among civilian institutions and the US Department of Defense (US DoD) or supply chain operations involved therein. To address this imbalance, this paper provides US DoD healthcare supply chain managers with concepts related to communicating and planning more effectively. It is worth remembering, however, that all disasters are local - under the auspice of tiered response involving federal agencies, the principal responsibility for responding to domestic disasters and emergencies rests with the lowest level of government equipped and able to deal with the incident effectively. As such, the findings are equally applicable to institutions outside the military. It also bears repeating that every crisis is unique: there is no such thing as a uniform response for every incident. The role of the US DoD in emergency preparedness and disaster planning is changing and will continue to do so as the need for roles in support of a larger effort also continues to change.",Journal of business continuity &amp; emergency planning,2017-12-01,
Outsourcing strategies and distribution models in Italian Pharma Supply Chain,"In the pharmaceutical supply chain, all players have to ensure the highest level of service while containing costs, because of the ethical issues concerning drugs. The outsourcing of logistics should be recognized as a competitive lever, especially in this complex and highly regulated industry. Based on these premises, the research objective of this study is to investigate the relationship between the outsourcing strategies of manufacturers and the logistics services offered by Third-Party Logistics Service providers (3PLs). To achieve this objective, a multiple case study was designed to analyse the different physical distribution models adopted by pharmaceutical companies. We collected qualitative data and the subjective perceptions of several logistics directors, conducting structured interviews with 11 pharmaceutical companies and six 3PLs. We have identified three physical distribution models, on the basis of the number and location of the warehouses used (single warehouse, dual warehouse and multi-warehouse models). We discovered that there is a strict relationship between the physical distribution model adopted by pharmaceutical companies and their features (i.e. the main distribution channel, product portfolio, target service level, transport and warehousing costs and other company related issues). Our research also offers an empirical insight into the key logistic services that 3PLs should offer within the pharma industry. In conclusion, the study draws a roadmap to guide pharmaceutical companies in their strategic logistics decisions in Italy, while also considering possible future trends deriving from changes to European regulations.","Proceedings - 2017 IEEE International Conference on Service Operations and Logistics, and Informatics, SOLI 2017",2017-11-27,10.1109/SOLI.2017.8120990
A Roadmap Towards Healthcare Logistics in Thailand,"Apart from operation dimension in supply chain, another perspective in healthcare supply chain is the infrastructure for Logistics. This infrastructure concerns much in data and information flows. The study focuses on three levels for constructing this infrastructures: Public health policy maker, provincial public health office and hospital levels. A survey was conducted. The framework for data collections was based on data standardization, database and its applications. The findings identified the status of such areas. It shows that lack of standardization could lead to poor information in the supply chain. Five core components for the foundation are recommended. These are standard data, standard exchange data, a single data pool, ability to track and trace and data centre. Implications and suggestions for policy makers are recommended.","2017 International Conference on Industrial Engineering, Management Science and Application, ICIMSA 2017",2017-07-19,10.1109/ICIMSA.2017.7985578
Mathematical model and exact algorithm for the home care worker scheduling and routing problem with lunch break requirements,"Home health care or home care (HHC/HC) refers to the delivery of social, medical and paramedical services to clients in their own homes. Each day, care workers start from the HHC/HC centre, visit some clients and return to the centre. During the service delivery process, there is usually a lunch break for each worker. In this paper, we address a real-life home care worker scheduling and routing problem with the consideration of lunch break requirements. A three-index mathematical model is constructed for the problem. The problem is decomposed into a master problem and several pricing sub-problems, and is optimally solved by a branch-and-price (B&P) algorithm. Specifically, a sophisticated label-correcting algorithm is designed to address lunch break constraints in pricing sub-problems; some cutting-edge acceleration strategies are applied during the column generation process. Experimental results show that the proposed B&P algorithm is able to produce satisfied solutions within an acceptable runtime and outperforms the mixed integer programming solver CPLEX.",International Journal of Production Research,2017-01-17,10.1080/00207543.2016.1213917
Wireless sensor node design,"Remote monitoring system is a part of Internet of Thing (IoT) application whether in healthcare, logistic or even agriculture. The system consists of several nodes including wireless sensor node which is a compulsory end-device part in remote monitoring system for data acquisition and processing. This paper discusses the available design of wireless sensor node from different hardware and interfaces, comparison and reasoning of the available design for the hardware such as the microcontroller and transceiver. A propose design provided in this paper using an ARM based microcontroller for raw data processing and nRF24L01 transceiver in wireless communication.","2016 3rd International Conference on Electronic Design, ICED 2016",2017-01-03,10.1109/ICED.2016.7804662
A structured review of quantitative models of the pharmaceutical supply chain,"The aim of this review is to identify and provide a structured overview of quantitative models in the pharmaceutical supply chain, a subject not exhaustively studied in the previous reviews on healthcare logistics related mostly to quantitative models in healthcare or logistics studies in hospitals. The models are classified into three categories of classification: network design, inventory models, and optimization of a pharmaceutical supply chain. A taxonomy for each category is shown describing the principal features of each echelon included in the review; this taxonomy allows the readers to identify easily a paper based on the actors of the pharmaceutical supply chain. The search process included research articles published in the databases between 1984 and November 2016. In total 46 studies were included. In the review process we found that in the three fields the most common source of uncertainty used is the demand in the 56% of the cases. Within the review process we can conclude that most of the articles in the literature are focused on the optimization of the pharmaceutical supply chain and inventory models but the field on supply chain network design is not deeply studied.",Complexity,2017-01-01,10.1155/2017/5297406
The Routledge Companion to Lean Management,"Interest in the phenomenon known as ""lean"" has grown significantly in recent years. This is the first volume to provide an academically rigorous overview of the field of lean management, introducing the reader to the application of lean in diverse application areas, from the production floor to sales and marketing, from the automobile industry to academic institutions. The volume collects contributions from well-known lean experts and up-and-coming scholars from around the world. The chapters provide a detailed description of lean management across the manufacturing enterprise (supply chain, accounting, production, sales, IT etc.), and offer important perspectives for applying lean across different industries (construction, healthcare, logistics). The contributors address challenges and opportunities for future development in each of the lean application areas, concluding most chapters with a short case study to illustrate current best practice. The book is divided into three parts: The Lean Enterprise Lean across Industries A Lean World. This handbook is an excellent resource for business and management students as well as any academics, scholars, practitioners, and consultants interested in the ""lean world.""",The Routledge Companion to Lean Management,2016-12-08,10.4324/9781315686899
Improvement of the lean-maintenance by hospital logistics,"Lean maintenance is a new thinking looking for ways to reduce maintenance costs by focusing on adding value operations. Healthcare logistics aims also to minimize costs of several functions including maintenance. In that context, this paper intends to show the impact of lean and logistics on maintenance in hospitals. For that, the first part describes the interest of the Lean and logistics on maintenance and reviewed previous research related to Lean-Logistics in the hospital maintenance. The second part presents the principal steps of the methodology followed. The third illustrates the proposed methodology through a case study that allows studying the impact of grouping of hospital pharmacies and Lean on the effectiveness of the medical devices maintenance. We finish our paper with a conclusion and work prospective.","Colloquium in Information Science and Technology, CIST",2016-07-02,10.1109/CIST.2016.7805047
Internet of Things-robustness and reliability,"Internet of Things (IoT) has a disruptive impact on variety of application domains like healthcare, logistics, transportation, etc., where network-enabled embedded devices work proactively and collaboratively to solve a complex decision-making problem in real time. Many of these applications are business critical, and require the underlying technology to be dependable, that is, it must deliver its service even in the presence of failures. In this chapter we discuss the notion of reliability and recovery oriented systems in general and then explain why this is important for an IoT-based system. We discuss various failure scenarios and reliability challenges that exist at different layers of an IoT-based system. Next, we discuss various failure-prevention and fault-tolerance approaches to make an IoT-based system robust. Energy consumption by IoT devices plays a major role in the overall system reliability. In this chapter we discuss various reliability challenges due to the low-power devices and solutions that have emerged to improve the overall reliability of such devices and the whole system.",Internet of Things: Principles and Paradigms,2016-05-11,10.1016/B978-0-12-805395-9.00011-3
Benchmarking of health technologies distribution models: An investigation of Lombardy’s local health authorities,"Purpose – The purpose of this paper is to develop a benchmarking framework for assessing the performance of the distribution models adopted by the local branches of National Health Services (NHSs) for delivering health technologies to patients at a local level, and to derive prescriptions for enhancing design and optimal management of the distribution models. Design/methodology/approach – The authors focussed the study on the distribution of absorbent devices for incontinence, adopting the analytic hierarchy process as a tool for developing the benchmarking framework. The authors applied the framework to the context of the Italian NHS with respect to the Lombard Local Health Authorities, assessing their performance in terms of operational efficiency and service quality. Findings – The developed framework constitutes a novel contribution, and it allows for generating prescriptions. Through its application to the context studied the authors found that a “one-size-fits-all” distribution model cannot be proposed, as regards both efficiency and effectiveness, since process standardization does not provide benefits or savings in all contexts. Rather, a total landed cost approach in the evaluation of the distribution practices must be adopted. Practical implications – This paper offers to managers and decision makers an innovative approach to the design of distribution models for health technologies. It provides policy makers with prescriptions to develop regulations fostering a comprehensive view of the factors for an optimal health technologies distribution at a local level. Originality/value – Given the dearth of scientific publications focussed on the distribution at the local level of health technologies, this paper significantly contributes to the existing body of knowledge and it offers an innovative framework which can be proficiently replicated in manifold contexts.",Benchmarking,2016-05-03,10.1108/BIJ-12-2013-0123
Robotnik—professional service robotics applications with ROS,"This chapter summarizes our most relevant experiences in the use of ROS in the deployment of Real-World professional service robotics applications: a mobile robot for CBRN interventionmissions, a tunnel inspection and surveillance robot, an upper body torso robot, an indoor healthcare logistic transport robot and a robot for precision viticulture. The chapter describes thementioned projects and how ROS has been used in them. It focuses on the application development, on the ROS modules used and the ROS tools and components applied, and on the lessons learnt in the development process.",Studies in Computational Intelligence,2016-02-01,10.1007/978-3-319-26054-9_10
A way for reducing drug supply chain cost for a hospital district: A case study,"Purpose: This work aims at providing insights to optimise healthcare logistic of the drug management, in order to deal with the healthcare expenditure cut. In this paper the effects of different drug supply chain configurations, on the resulting average stock, service level and Bullwhip effect, of the studied supply chain, is quantitatively assessed. Design/methodology/approach: A case study of an Italian district has been studied, taking into account three echelons: suppliers, central stock, and hospitals. A model of the various supply chain configurations has been created with the use of the simulation. Specifically, 24 supply chain configurations have been examined, stemming from the combination of several supply chain design parameters, namely: transshipment policies (Emergency Lateral Transshipment or Total Inventory Equalization); re-order and inventory management policies (Economic Order Quantity or Economic Order Interval); required service levels (90% or 95%); the number of available vans (one or two). For each configuration, hospital average stock, service level and a “Bullwhip effect” analysis are computed. To know which input variables are statistically significant, a DoE (Design of Experiments) analysis has been executed. Findings: The output of this paper provides useful insights and suggestions to optimize the healthcare logistic and drug supply chain. According to the developed DoE analysis, it can be stated that the introduction of transshipment policies provides important improvement in terms of service and stock levels. To reduce the Bullwhip effect, which results in a service level decreasing, and in a managing stock costs increasing, it is worth to adopt an EOQ re-order policy. Practical implications: This research gives practical recommendations to the studied system, in order to reduce costs and maintain a very satisfactory service level. Originality/value: This paper fulfils an identified need to study which combination of transshipment policies, re-order/inventory management policies and required service levels, can be the best one to reduce costs and maintain a very satisfactory service level, in the specific logistic system.",Journal of Industrial Engineering and Management,2016-01-01,10.3926/jiem.1262
Occupational safety and health and smaller organisations: Research challenges and opportunities,"Despite the prevalence of small and medium-sized enterprises (SMEs) and micro organisations, comparatively little is known about how such organisations approach occupational safety and health (OSH). Research has tended to present a negative picture of OSH practices in smaller organisations. This paper discusses some of the challenges to researching OSH in SMEs and micro organisations and how these challenges can be overcome. It draws lessons and experiences from a qualitative study involving 149 structured interviews, nine short-term ethnographies and 21 semi-structured interviews with owners and employees in SMEs and micro organisations from a broad cross-section of industry sectors in the UK, including construction, retail, healthcare, logistics and agriculture. Data from the study suggest that the established boundaries between micro, small and medium-sized enterprises are less meaningful in an OSH context – OSH practices are influenced more by the culture of the organisation, the type of work being undertaken and the sector that an organisation operates in. OSH practices in SMEs and micro organisations tend to reflect more informal characteristics of such organisations, with more emphasis (than many larger organisations) on tacit knowledge, learning by doing and improvisation. Such practices should not necessarily be assumed to be unsafe or incompatible with formalised OSH.",Policy and Practice in Health and Safety,2016-01-01,10.1080/14773996.2016.1239357
Model-based testing as a service for IoT platforms,"The Internet of Things (IoT) has increased its footprint becoming globally a ‘must have’ for today’s most innovative companies. Applications extend to multitude of domains, such as smart cities, healthcare, logistics, manufacturing, etc. Gartner Group estimates an increase up to 21 billion connected things by 2020. To manage ‘things’ heterogeneity and data streams over large scale and secured deployments, IoT and data platforms are becoming a central part of the IoT. To respond to this fast growing demand we see more and more platforms being developed, requiring systematic testing. Combining Model-Based Testing (MBT) technique and a service-oriented solution, we present Model-Based Testing As A Service (MBTAAS) for testing data and IoT platforms. In this paper, we present a first step towards MBTAAS for data and IoT Platforms, with experimentation on FIWARE, one of the EU most emerging IoT enabled platforms.",Lecture Notes in Computer Science (including subseries Lecture Notes in Artificial Intelligence and Lecture Notes in Bioinformatics),2016-01-01,10.1007/978-3-319-47169-3_55
Evaluating seed germination monitoring system by application of wireless sensor networks: A survey,"In this grand era of technology the wireless sensor networks outstand to serve multidisciplinary fields of technology whether it be technology, agriculture, healthcare, logistics monitoring etc. Agriculture field has recently adopted the wireless sensor technology to enhance the production and monitoring of crops in a more efficient manner. This paper presents the various applications of wireless sensor networks adopted for monitoring and measuring various parameters for crop and seed germination for effective yield generation. In this paper various parameters are monitored by using wireless sensor networks. Also in this paper a survey of most used sensor nodes and the features that they comprise of are depicted to analyze their usage in the various domains. This paper discusses the advantages of sensor nodes such as cheaper cost, compact size and how they help in managing the agricultural application yielding to best quality crops. The work in implementing wireless sensor nodes is ongoing and a survey in various dimensions is discussed in this paper.",Advances in Intelligent Systems and Computing,2016-01-01,10.1007/978-81-322-2731-1_24
Healthcare logistic network models for shared resource management,"In this work, we propose a simulation-based optimization approach that addresses the problem of the design of collaborative healthcare logistic networks through the re-thinking of the inventory management process and the resources sharing rules. We especially analyze the gains from medical supplies pooling within a group of nearby hospitals through the instrumentation of the inventory centralization scheme and the rules for lateral inventory sharing such as the emergency lateral transshipment.",Proceedings - CIE 45: 2015 International Conference on Computers and Industrial Engineering,2015-01-01,
