Title,Abstract,Journal,Publishing Date,DOI,Label
A case study of collaborative communications within healthcare logistics,"Purpose: The purpose of this paper is to present a collaborative communications model developed during the conduct of a recent academic research study and provide information to healthcare supply chain managers and administrators. Design/methodology/approach: Using data collected from a case study involving healthcare supply chain managers in the United States Army, this work examines how collaborative communications is linked to healthcare supply chain management. The findings associated with this study may have many transferable applications to institutions beyond a military health services context. Findings: This paper presents the findings and conclusions ascertained during a case study of collaborative communications. Five emerging themes were identified and a management model was developed for the enhancement of healthcare supply chain operations. Emerging themes included synergy among organizations, stakeholders working together, enhancements in supply chain operations, a continuance of training for supply chain leaders, and commonalities among disparate levels of management. Practical implications: Healthcare is a continually evolving industry. Supply chain efficiency can be linked to potential cost savings and more efficient operations within healthcare organizations. By understanding a model related to communicating collaboratively, leaders begin to understand the need for partnering among internal and external stakeholders and creating more efficient practices and processes. While this discussion is directed specifically toward healthcare management, the principles are applicable across a wide array of industries. Social implications: Communicating effectively is never easy for any healthcare organization or staff. Whether isolated to key individuals or throughout the entire organization, leaders have an inherent responsibility to share information and set conditions for organizational success. Arguably, the critical path to success involves effective, collaborative communications across multiple echelons of management responsibilities. Originality/value: While there is a dearth of literature examining communications and collaboration among various industries, little information is directed specifically toward the management of healthcare organizations or supply chain operations. In an applied sense, this model provides healthcare supply chain managers with concepts related to communicating more effectively at both the individual and organizational levels. © Emerald Group Publishing Limited.",Leadership in Health Services,01/02/2011,10.1108/17511871111102526,1
Oral anticoagulant treatment: A cost-benefit study,"More than 1% of the population are on oral anticoagulant treatment (OAT), a figure which is growing by over 10% annually. The demand for the clinical and analytical services necessary for monitoring this treatment requires the assignment of significant economical and healthcare logistic resources. Comparative studies of the multiple control strategies (attending hospital, primary care or self-monitoring) should be set up, and should reflect not only the costs of their performance but also their clinical results, measures such as mortality and morbidity of thrombotic and haemorrhagic episodes that, have occurred and been avoided. During 2003,20,347 patients on OAT were monitored in 4 anticoagulation units of large national hospitals providing healthcare cover to 1,641,914 inhabitants, Thrombotic or haemorrhagic episodes were recorded and the same events that should have occurred, according to their pathologies, were calculated. Two hundred and ninety-nine thromboembolic complications occurred which led to 129 hospital admissions and there were 11 deaths. Serious haemorrhagic complications resulted in IBI hospital admissions and caused 20 deaths. The costs of OAT in the population attended (medication and their clinical/analytical monitoring) were estimated at €2,749,813,The healthcare costs (calculated according to the DRG of the pathologies) of the clinical complications which occurred were estimated at €1,068,259. The complications avoided were calculated at. more than 100 deaths, 1,044 cerebrovascular accidents and 583 thrombotic recurrences with estimated costs, in the acute intrahospital phase only, of greater than €5,000,000.",Revista de Administracion Sanitaria,01/07/2008,,1
"Intelligent Connectivity: AI, IoT, and 5G","Intelligent Connectivity: AI, IoT, and 5G delivers a comprehensive technological and economic analysis of intelligent connectivity and the integration of artificial intelligence, Internet of Things (IoT), and 5G. It covers a broad range of topics, including Machine-to-Machine (M2M) architectures, edge computing, cybersecurity, privacy, risk management, IoT architectures, and more. The book offers readers robust statistical data in the form of tables, schematic diagrams, and figures that provide a clear understanding of the topic, along with real-world examples of applications and services of intelligent connectivity in different sectors of the economy. Intelligent Connectivity describes key aspects of the digital transformation coming with the 4th industrial revolution that will touch on industries as disparate as transportation, education, healthcare, logistics, entertainment, security, and manufacturing. Readers will also get access to: A thorough introduction to technology adoption and emerging trends in technology, including business trends and disruptive new applications Comprehensive explorations of telecommunications transformation and intelligent connectivity, including learning algorithms, machine learning, and deep learning Practical discussions of the Internet of Things, including its potential for disruption and future trends for technological developmentIn-depth examinations of 5G wireless technology, including discussions of the first five generations of wireless techIdeal for telecom and information technology managers, directors, and engineers, Intelligent Connectivity: AI, IoT, and 5G is also an indispensable resource for senior undergraduate and graduate students in telecom and comp uter science programs.","Intelligent Connectivity: AI, IoT, and 5G",01/01/2021,10.1002/9781119685265,0
Modelling hospital materials management processes,"Materials management is an important issue for healthcare systems because it influences clinical and financial outcomes. Before selecting, adapting and implementing leading or optimized practices, a good understanding of processes and activities has to be developed. In real applications, the information flows and business strategies involved are different from hospital to hospital, depending on context, culture and available resources; it is therefore difficult to find a comprehensive and exhaustive description of processes, even more so a clear formalization of them. The objective of this paper is twofold. First, it proposes an integrated and detailed analysis and description model for hospital materials management data and tasks, which is able to tackle information from patient requirements to usage, from replenishment requests to supplying and handling activities. The model takes account of medical risk reduction, traceability and streamlined processes perspectives. Second, the paper translates this information into a business process model and mathematical formalization. The study provides a useful guide to the various relevant technology-related, management and business issues, laying the foundations of an efficient reengineering of the supply chain to reduce healthcare costs and improve the quality of care. © 2013 Iannoneet al.",International Journal of Engineering Business Management,01/01/2013,10.5772/56607,1
Logistics chain optimization and scheduling of hospital pharmacy drugs using genetic algorithms: Morocco case,"In recent years, the health sector has faced increasingly important challenges. Due to the economic crisis and competitions, hospitals are facing many issues affecting the supply chain, such as budget cuts or lack thereof as well as insufficient human resources. Although essential for an excellent service, logistics take up a considerable part of the budget as challenges need to be addressed such as delays in drugs delivery, transportation and storage conditions, routing and scheduling. As to governance, each hospital is assigned to a specific region, which cannot be defined due to political, demographic, or geographic issues. This paper focuses on multi-depot vehicle routing problem (MDVRP) in healthcare logistics to feed the hospital pharmacies. The idea is to apply MDVRP’s approach to the health sector, specifically hospital pharmacies. In this projection, hospitals are considered to present clients, and central pharmacies present deposits. This problem (the MDVRP) is known by this nature NP-hard. For that, the heuristic method was used as genetic algorithm to solve the problem. The paper is organized as follows, the first section discusses, compares, and proposes clustering methods for healthcare facilities with applying them on Moroccan hospitals case; the second section proposes a genetic algorithm to resolve the MDVRP with a simulation.",International Journal of Web-Based Learning and Teaching Technologies,01/03/2021,10.4018/IJWLTT.2021030104,1
An evaluation of the delivery of medicines using drones,"This study tests the impact of drone transportation on the quality of a medicine. Modelling the critical process parameters of drone flight, the effects of temperature and vibration on insulin were investigated using the pharmacopoeia methods. The medicine, Actrapid, (3.5 mg/mL of insulin), was flown by a quad-rotor drone. Insulin stored between −20 and 40◦C for 30 mins, and subjected to vibration (0–40 Hz, 25◦C, 30 mins) passed the pharmacopeia tests. Dynamic light scattering identified the active tetrameric and hexameric forms of insulin post testing. Vibration frequencies during drone flight were between 0.1 and 3.4 Hz. There was no evidence of visible insulin aggregates following the drone transportation. The differences in UV absorbance readings between flown Actrapid and controls were insignificant (p = 0.89). No adverse impact of drone transport on insulin was observed. This study provides supporting evidence that drone transportation of medicinal products containing insulin is feasible. The authors recommend that when considering the drone delivery of medicines five tests need to be applied. These tests must determine the safe flight time and range, the quality of the medicine post flight, the onboard conditions experienced by the medicine, the security of the drone supply chain and the effect of drone failure on both the medicine and the environment.",Drones,01/09/2019,10.3390/drones3030052,1
Logistical and structural challenges are the major obstacles for family medicine physicians’ ability to administer adult vaccines,"Purpose: This study was conducted to characterize the vaccination practices and challenges of family medicine physicians in Los Angeles County, California. Methods: The Los Angeles Academy of Family Physicians (LA AFP) sent out electronic surveys to all of their active members (N = 1121) between December 2017 and January 2018, and asked them to answer questions about themselves, their practice, their patient population, and their immunization practices and challenges. We then analyzed the results through basic statistical calculations and Pearson’s chi-squared tests. Results: Seventy-four people (6.6%) responded to the survey, and 75% of responders stated that they administer all Advisory Committee on Immunization Practices (ACIP) recommended vaccines. The lowest vaccine administration rates were for the high-dose influenza vaccine, which 66.2% (n = 49) of respondents reported to administer, followed by the meningococcal B vaccine (68.9%; n = 51). The respondents who belonged to practices with more than 11 providers, were part of a large hospital or healthcare system, had electronic medical records (EMRs), and used the California Immunization Registry (CAIR) were more likely to report to vaccinate. The number one responding physician-reported challenge to vaccination was limited time and resources to address patient resistance followed by vaccine cost and lack of infrastructure to store vaccines. Conclusions: In this pilot study, structural and logistical challenges appeared to make the biggest impact on adult vaccination for the responding family medicine physicians. Solutions addressing these challenges will help improve the adult immunization rates.",Human Vaccines and Immunotherapeutics,04/03/2019,10.1080/21645515.2018.1543524,1
Towards flexible process support on mobile devices,"Ubiquitous computing is considered as enabler for linking everyday life with information and communication technology. However, developing pervasive and mobile applications that provide personalized user assistance still constitutes a challenge. Mobile application scenarios are diverse and encompass domains like healthcare, logistics, and sales. For their support two fundamental technologies with increasing maturity are emerging: development frameworks for mobile devices and light-weight process engines. Their integrated use, however, is in a rather premature state. Generally, the use of a process engine for supporting mobile collaboration raises many challenging issues. This paper picks up some of these challenges and shows how we have coped with them in the MARPLE project. MARPLE targets at a tight integration of process management technology with mobile computing frameworks in order to enable mobile process support in advanced application scenarios. We give insights into the MARPLE architecture and its components. In particular, we introduce the MARPLE process engine, which enables light-weight as well as flexible process support on mobile devices. This will be key for mobile user assistance in advanced application scenarios. © 2011 Springer-Verlag Berlin Heidelberg.",Lecture Notes in Business Information Processing,01/01/2011,10.1007/978-3-642-17722-4_11,1
Pharmacy students' perspectives on the value of taking call during acute care practice experiences,"Objective. Determine graduates' perceptions of the benefits and limitations of taking call with the medicine team while in the experiential portion of the doctor of pharmacy (PharmD) degree program. Methods. Survey questionnaires were mailed to graduates who completed a medicine advanced pharmacy practice experience offering an on-call experience. Data collected included on-call requirements, participation, and perceptions of the benefits and limitations of participating in on-call activities. Results. Respondents generally agreed that they learned more about disease states and healthcare logistics during on-call experiences. Respondents also agreed it was a teambuilding experience and would encourage other students to take call. Conclusions. Taking call as a pharmacy student provides a unique opportunity to learn about disease states and build professional relationships with other healthcare professionals. This initial survey suggests that the perceived benefits of taking call outweigh the limitations, and that the experience incorporates professional development into pharmacy education.",American Journal of Pharmaceutical Education,01/01/2005,10.5688/aj690348,0
Healthcare logistics &amp; supply chain management in health industry of Indonesia based on the telemedicine,"The essential mission of logistics and supply chain management is to efficiently plan, organize, and coordinate the movement of goods from a point of origin to a point of consumption. Analyzing and aligning supply chain goals with a patient-first approach enables healthcare organizations to reduce costs while improving patient outcomes. With Patient Direct, a care delivery solution from HRS, this paper provides patients with the telehealth equipment they need when they need it by telemedicine. Telemedicine which is used interchangeably with the term telehealth is the remote delivery of healthcare to patients through information and communication technology, including communication between two or more health professionals who are not in the same location. Thus, it needs secure transmission of medical data through text, sound, image, or video. This system can be a tele-education, tele-monitoring, tele-consultation, or tele-intervention. Telemedicine has several benefits, both for health professionals and medical institution as well as for the patients, especially for the development of healthcare delivery in remote area and also to make interaction between healthcare professional faster. However, telemedicine still has lack of regulation in Indonesia. There is still no regulation about license for the health professional and safety of medical data. Ethical problems in telemedicine are also still an issue, especially about patient's confidentiality, and also it can weaken doctor-patients relationship. According code of ethics, a doctor must examine the patients first before making a diagnosis and treatment, which cannot be done with telemedicine. The lack of regulation and ethical consideration make telemedicine in Indonesia still has some problems and need a challenge for improvement.",International Journal of Supply Chain Management,01/01/2020,,0
Performance evaluation of FIWARE: A cloud-based IoT platform for smart cities,"As the Internet of Things (IoT) becomes a reality, millions of devices will be connected to IoT platforms in smart cities. These devices will cater to several areas within a smart city such as healthcare, logistics, and transportation. These devices are expected to generate significant amounts of data requests at high data rates, therefore, necessitating the performance benchmarking of IoT platforms to ascertain whether they can efficiently handle such devices. In this article, we present our results gathered from extensive performance evaluation of the cloud-based IoT platform, FIWARE. In particular, to study FIWARE's performance, we developed a testbed and generated CoAP and MQTT data to emulate large-scale IoT deployments, crucial for future smart cities. We performed extensive tests and studied FIWARE's performance regarding vertical and horizontal scalability. We present bottlenecks and limitations regarding FIWARE components and their cloud deployment. Finally, we discuss cost-efficient FIWARE deployment strategies that can be extremely beneficial to stakeholders aiming to deploy FIWARE as an IoT platform for smart cities.",Journal of Parallel and Distributed Computing,01/10/2019,10.1016/j.jpdc.2018.12.010,1
Simulation optimization for the inventory management of healthcare supplies,"This article covers the inventory management of healthcare supplies problem. Based on the mathematical programming model set out by [1], a causal model and a flow chart were developed to outline the simulation model, which was to be later applied to a highly specialized medical institution that performs high-risk heart surgery, such as catheterizations and angioplasties. With this simulation model, a purchases plan with 21 healthcare supplies was obtained that contemplates all the problem’s restrictions: purchasing policy (safety stock, available budget); the warehouse’s physical reality (warehouse capacity); characteristics of supplies (useful life, service level); and suppliers (price, capacity and size of lots or rounding value). Different indicators were also considered, such as service levels, costs of purchases, stockouts costs and inventory maintenance costs. The results obtained with the simulation model came very close to the mathematical programming results, but the computing times were considerably shorter.",International Journal of Simulation Modelling,01/06/2020,10.2507/IJSIMM19-2-514,0
Impacts of Losses Functions on the Quality of the Ultrasound Image by Using Machine Learning Algorithms,"During last decade, Artificial Intelligence (AI) has been able to reshape our life daily. Different areas were positively impacted by AI such as Healthcare, Logistic, etc. Medical imaging is one of the fields of healthcare in which AI was introduced to solve and overcome different problems. Challenges including image processing, signal processing, and data acquisition. In this paper, we deeply demonstrate the loss function as one of the main parameters that influence the quality of the ultrasound (US) image. Therefore, we introduce the main components of ultrasound systems form end-to-end perspective such as the data acquisition, the signal processing, and the image interpretation. Then, we present the losses functions as a critical performance metrics for the model validation. Metrics such as the Mean Absolute Error (MAE), Cross-Entropy loss function (CE), Dice Similarity Coefficient (DSC), and the Structural Similarity (SSIM). After that we present the adopted CNN model to generate ultrasound image. The excessive simulation results demonstrate that the selection of the loss function provides significant improvement in terms of image quality (e.g., contrast, CNR and SNR). Choosing simple loss functions such as mean square error helps to faster the convergence of the convolution neural network during the training process. However, for image quality enhancement, we propose the combination of different loss functions such structural similarity (SSIM) with Dice Similarity Coefficient (DSC).","2021 IEEE International Conference on Automatic Control and Intelligent Systems, I2CACIS 2021 - Proceedings",26/06/2021,10.1109/I2CACIS52118.2021.9495878,0
Transportation-Induced Carbon Emissions Jeopardize Healthcare Logistics Sustainability: Toward a Healthier Today and a Better Tomorrow,"Background: Logistics operations are considered essential for transporting commodities from one location to another, helping to promote global economic activity. On the other hand, its negative impact eclipses its positive impact, namely the rise in healthcare expenditures due to its ecological footprint. Globally, rising out-of-pocket health expenses result from logistic-induced carbon emissions, posing a danger to the long-term viability of healthcare. Methods: Based on this critical fact, this study examined the impact of logistics operations on healthcare costs by controlling for carbon emissions, fuel imports, and economic development across a large cross-section of 131 nations by using the Robust Least Squares Regression. Results: The findings demonstrate a U-shaped association between logistical operations and healthcare expenditures, i.e., if there is a 1% increase in logistics operations, healthcare expenditures decrease by −2.421% initially, while at later stages, healthcare costs would increase by 0.139%. On the other hand, increased fuel imports and economic growth due to logistics activities are increasing healthcare expenditures with an elasticity estimate of 0.087% and 0.147%, respectively. According to the forecasting predictions, logistics-induced carbon emissions, fuel imports, and economic expansion will increase healthcare expenses. Conclusions: A sustainable logistics operation is critical for strengthening healthcare infrastructure and meeting the global carbon neutrality goal.",Logistics,01/06/2022,10.3390/logistics6020027,0
An alert and detection system for cyber-attacks on iot devices,"The internet of things (IoT) is still in its early stages, but it has sparked interest in a wide range of industries, including healthcare, logistics tracking, smart cities, and transportation. However, it is also vulnerable to a variety of serious network infiltration concerns. This chapter contributes to attack detection and alert system for IoT networks. This system provides alert and detection of cyber-attacks at the router level by configuring Rpi as a wireless router for IoT network. For the detection method, the authors used an anomaly-based approach that learns the packets in the network using deep learning. IoTID20 dataset is used for training the deep learning model. This model detects four kinds of attack: DoS, MITM, port scan, and scan. When the attack is detected, the user is alerted via e-mail and SMS. Copyright",Handbook of Research on Network-Enabled IoT Applications for Smart City Services,26/09/2023,10.4018/979-8-3693-0744-1.ch011,0
